GOOGLE	2013/07/18	2013/07/21	EUROPE	U.K.'s Cameron to Warn Search Firms on Child Porn	Nicholas Winning	July 21, 2013 9:14 pm ET	The U.K. prime minister will tell Google, Yahoo and others they must block online searches for images of child abuse or face new laws.	https://www.wsj.com/articles/SB10001424127887324328904578620522773487696?mod=searchresults&page=1&pos=1
GOOGLE	2013/07/18	2013/07/21	JOURNAL REPORTS: LEADERSHIP	Scarred by Financial Crisis, U.S. Companies Continue to Hoard Cash	Chana R. Schoenberger	July 21, 2013 4:01 pm ET	They have good reasons for boosting their cash positions, these experts say.	https://www.wsj.com/articles/SB10001424127887323419604578573881623377200?mod=searchresults&page=1&pos=2
GOOGLE	2013/07/18	2013/07/21	JAPAN	Web Savvy Pros Optimize Japanese Campaigns	Alexander Martin	July 21, 2013 9:31 am ET	Before Detroit's filing, which city had the largest municipal bankruptcy? What's new on the new Google maps for the iPhone? A new spa treatment in Japan involves putting what on your face? Test your knowledge of the week's events.	https://www.wsj.com/articles/SB10001424127887323309404578614883726320840?mod=searchresults&page=1&pos=3
GOOGLE	2013/07/18	2013/07/21	U.S.	News Quiz - July 13 - 19	Brian Costa	July 20, 2013 10:13 am ET	As the New York Yankees look to patch up their tattered roster this month, they're finding that the old reliable salary-dump trade is vanishing.	https://www.wsj.com/articles/SB10001424127887323309404578617620447115186?mod=searchresults&page=1&pos=4
GOOGLE	2013/07/18	2013/07/21	BRIAN COSTA	Yanks Are Shopping But Few Are Selling	Ruth Simon	July 19, 2013 10:29 pm ET	After six years of declines, some longer-term certificates of deposit are looking like better deals.	https://www.wsj.com/articles/SB10001424127887324448104578616401976160038?mod=searchresults&page=1&pos=5
GOOGLE	2013/07/18	2013/07/21	WEEKEND INVESTOR	Rates on CDs Start to Rise	Shira Ovide	July 19, 2013 6:52 pm ET	Shares of Microsoft, and to a lesser extent Google, were hammered as investors hit the panic button on earnings disappointments from tech giants.	https://www.wsj.com/articles/SB10001424127887323664204578609681812809770?mod=searchresults&page=1&pos=6
GOOGLE	2013/07/18	2013/07/21	BUSINESS	Microsoft Shares Drop in Down Day for Tech	Ian Sherr	July 19, 2013 6:46 pm ET	The two companies have held a series of private negotiations about their patent disputes since last summer.	https://www.wsj.com/articles/SB10001424127887324263404578616191268105174?mod=searchresults&page=1&pos=7
GOOGLE	2013/07/18	2013/07/21	TECH	Apple, Samsung in Renewed Settlement Talks, but Deal Elusive	Rolfe Winkler	July 19, 2013 6:10 pm ET	Tech companies are missing estimates left, right and center this quarter. Save Google, they all have a big problem.	https://www.wsj.com/articles/SB10001424127887324263404578615822955627726?mod=searchresults&page=1&pos=8
GOOGLE	2013/07/18	2013/07/21	HEARD ON THE STREET	Big Tech: Too Big for Its Own Good	Matt Jarzemsky	July 19, 2013 4:55 pm ET	The Standard & Poor's 500-stock index inched up to a fresh record.	https://www.wsj.com/articles/SB10001424127887324263404578616112736407492?mod=searchresults&page=1&pos=9
GOOGLE	2013/07/18	2013/07/21	U.S. MARKETS	S&P 500 Climbs, but Tech Sector Weighs	Min Zeng	July 19, 2013 4:40 pm ET	Treasury bonds rallied and capped a second consecutive weekly price gain as the U.S. central bank chief soothed fears over rising interest rates.	https://www.wsj.com/articles/SB10001424127887324448104578615332445103750?mod=searchresults&page=1&pos=10
GOOGLE	2013/07/18	2013/07/21	TREASURYS	Treasurys Gain for Second Straight Week	Paul Hannon	July 19, 2013 3:54 pm ET	The G-20 is set to back a major reform of international taxation designed to eliminate loopholes that enable many companies to keep their tax bills low.	https://www.wsj.com/articles/SB10001424127887323993804578615602367331038?mod=searchresults&page=1&pos=11
GOOGLE	2013/07/18	2013/07/21	WORLD	G-20 to Back Corporate Tax Reform	Sara Sjolin	July 19, 2013 2:01 pm ET	The Stoxx Europe 600 index edged up to a seven-week high and ended in positive territory for a fourth straight week.	https://www.wsj.com/articles/SB10001424127887323993804578615121919760716?mod=searchresults&page=1&pos=12
GOOGLE	2013/07/18	2013/07/21	EUROPE MARKETS	European Stocks Edge Higher	Paul Mozur	July 19, 2013 2:01 pm ET	Chinese Internet firm Qihoo 360 is in talks to acquire Sohu.com's Sogou search business, potentially raising a challenge to Baidu in the Chinese search market.	https://www.wsj.com/articles/SB10001424127887324448104578615930377200150?mod=searchresults&page=1&pos=13
GOOGLE	2013/07/18	2013/07/21	ASIA TECHNOLOGY	Qihoo 360 In Talks to Buy Sohu's Search Business	Daniel Inman	July 19, 2013 1:32 pm ET	Asian markets were mostly lower, with Japan underperforming in choppy trading. The Nikkei fell 1.5%. European stocks fell.	https://www.wsj.com/articles/SB10001424127887324448104578615252522673238?mod=searchresults&page=1&pos=14
GOOGLE	2013/07/18	2013/07/21	ASIA MARKETS	Tokyo Shares Down in Choppy Trade	Amir Efrati	July 19, 2013 6:42 am ET	Google's profit and sales continued to climb, but deceleration in the growth of its main business of selling search ads reignited concerns about the impact of mobile devices.	https://www.wsj.com/articles/SB10001424127887323993804578614620521728286?mod=searchresults&page=1&pos=15
GOOGLE	2013/07/18	2013/07/21	BUSINESS	Google Earnings: Profit Up but Search-Ad Prices Drop 6%	Don Clark	July 18, 2013 8:21 pm ET	Microsoft took a $900 million charge on its high-profile Surface RT tablet, contributing to fourth-quarter results that sharply missed revenue and profit expectations.	https://www.wsj.com/articles/SB10001424127887324263404578614290220266684?mod=searchresults&page=1&pos=16
GOOGLE	2013/07/18	2013/07/21	EARNINGS	Microsoft Earnings: Another Big Miss	Lauren Schuker Blum	July 18, 2013 8:03 pm ET	A new generation is skipping the "starter home" and betting on high-end real estate.	https://www.wsj.com/articles/SB10001424127887324263404578614243146061124?mod=searchresults&page=1&pos=17
GOOGLE	2013/07/18	2013/07/21	REAL ESTATE	The Rise of the Young Buyer	Will Connors	July 18, 2013 7:29 pm ET	Samsung is close to signing deals for its devices with two U.S. government agencies, signs that the South Korean company's push into the government sector traditionally dominated by BlackBerry is gaining some traction.	https://www.wsj.com/articles/SB10001424127887324879504578601711248140752?mod=searchresults&page=1&pos=18
GOOGLE	2013/07/18	2013/07/21	ASIAN BUSINESS NEWS	Samsung Nears Deals With 2 U.S. Agencies	Juhana Rossi	July 18, 2013 7:03 pm ET	Nokia showed little progress in turning around the fortunes of its mobile device business, even after a barrage of launches for the Lumia and Asha phones.	https://www.wsj.com/articles/SB10001424127887324263404578613882268258570?mod=searchresults&page=1&pos=19
GOOGLE	2013/07/18	2013/07/21	EARNINGS
Nokia's Turnaround Has Long Way to Go
By Juhana Rossi July 18, 2013 6:55 pm ET
Nokia showed little progress in turning around the fortunes of its mobile device business, even after a barrage of launches for the Lumia and Asha phones.
NEW YORK TIMES	2013/08/01	2013/08/04	MARKETS	Tourre Verdict Could Prolong Goldman's Pain	Justin Baer	Aug. 4, 2013 11:42 pm ET	Goldman Sachs may have hoped to relegate Fabrice Tourre's legal troubles to its past. Yet with last week's verdict, the firm and former trader remain bound together by the fallout from a 2007 deal.	https://www.wsj.com/articles/SB10001424127887323420604578647971040860936?mod=searchresults&page=1&pos=1
NEW YORK TIMES	2013/08/01	2013/08/04	NY FOOD	Shop Til You Drop at Pop-Up Market	Elva Ramirez	Aug. 4, 2013 11:29 pm ET	Super(Duper)Market sold everything from crocheted oysters to artisanal chocolate from Missouri to experimental ice cream from San Francisco during its second three-day shopping extravaganza.	https://www.wsj.com/articles/SB10001424127887323514404578648193185467434?mod=searchresults&page=1&pos=2
NEW YORK TIMES	2013/08/01	2013/08/04	NY REAL ESTATE COMMERCIAL	Governor, Development Offices Get Reduced Rate	null	Aug. 4, 2013 11:09 pm ET	Gov. Andrew Cuomo and Empire State Development Corp. are getting a rent reduction on their office space at 633 Third Ave.	https://www.wsj.com/articles/SB10001424127887324635904578644293357217484?mod=searchresults&page=1&pos=3
NEW YORK TIMES	2013/08/01	2013/08/04	NY REAL ESTATE COMMERCIAL	Heading Back to the Seaport	Carmel Melouney	Aug. 4, 2013 11:05 pm ET	Some South Street Seaport businesses that were displaced by superstorm Sandy are finally returning to their properties eight months later.	https://www.wsj.com/articles/SB10001424127887324635904578643941502477114?mod=searchresults&page=1&pos=4
NEW YORK TIMES	2013/08/01	2013/08/04	NY REAL ESTATE COMMERCIAL	'More Resilient' in the Rockaways	Anthony Paletta	Aug. 4, 2013 10:55 pm ET	A mere nine months after superstorm Sandy destroyed much of the area, Rockaway is sporting a new face, with much of the boardwalk reopened and studded with surprisingly sleek infrastructure.	https://www.wsj.com/articles/SB10001424127887323420604578648053155152528?mod=searchresults&page=1&pos=5
NEW YORK TIMES	2013/08/01	2013/08/04	NY REGION	Now Legal—10 a.m. Brunch	Josh Dawsey	Aug. 4, 2013 10:33 pm ET	For the first time in some four decades, city restaurants legally opened outdoor seating areas at 10 a.m. Sunday, after city officials repealed a law that said they couldn't open until noon.	https://www.wsj.com/articles/SB10001424127887324653004578648432005381050?mod=searchresults&page=1&pos=6
NEW YORK TIMES	2013/08/01	2013/08/04	A-HED	National-Park Visitors Are Asked to Take Their Trash With Them	Elizabeth Williamson	Aug. 4, 2013 10:30 pm ET	The Washington, D.C. region's pilot program calls for replacing trash bins from 27 locations along the parkway with twice as many signs telling people they are now expected to tote away their own refuse.	https://www.wsj.com/articles/SB10001424127887323664204578609552803040998?mod=searchresults&page=1&pos=7
NEW YORK TIMES	2013/08/01	2013/08/04	NY POLITICS	Mayoral Candidates Stake Out Own Ground Over Occupy Crackdown	Mike Vilensky	Aug. 4, 2013 10:17 pm ET	Nearly two years after Occupy Wall Street protesters took over a park in Lower Manhattan, mayoral candidates have strong opinions about how Mayor Michael Bloomberg responded.	https://www.wsj.com/articles/SB10001424127887323968704578648333429947770?mod=searchresults&page=1&pos=8
NEW YORK TIMES	2013/08/01	2013/08/04	NY CULTURE	Marina Abramovic Institute Reading of 'Solaris' Kicks Off With Lady Gaga	David Shapiro Jr.	Aug. 4, 2013 9:04 pm ET	More than 50 writers and artists gathered for a marathon reading of the sci-fi novel "Solaris," but the eight-hour event started with Lady Gaga intoning the opening chapter.	https://www.wsj.com/articles/SB10001424127887323514404578648192111432774?mod=searchresults&page=1&pos=9
NEW YORK TIMES	2013/08/01	2013/08/04	NY METS	The Mets Lose This One in the Sun	Jared Diamond	Aug. 4, 2013 8:59 pm ET	Marlon Byrd couldn't track two sky-high fly balls, and those miscues led to a Mets loss at the hands of the Royals.	https://www.wsj.com/articles/SB10001424127887323968704578648532177561960?mod=searchresults&page=1&pos=10
NEW YORK TIMES	2013/08/01	2013/08/04	NY YANKEES	Tim Marchman: CC Sabathia Might Not Be That Bad	Tim Marchman	Aug. 4, 2013 8:21 pm ET	The Yankees ace has lost fastball velocity and might not be a true ace anymore, but he hasn't been as bad as some people might think.	https://www.wsj.com/articles/SB10001424127887323420604578648081745109510?mod=searchresults&page=1&pos=11
NEW YORK TIMES	2013/08/01	2013/08/04	NY GIANTS	A Longtime Giants Coach's Weird Ways	Jonathan Clegg	Aug. 4, 2013 8:13 pm ET	Giants tight-ends coach Michael Pope has some odd drills, involving everything from swimming goggles to broomsticks to buckets of icy water and trash cans.	https://www.wsj.com/articles/SB10001424127887323968704578648533981034980?mod=searchresults&page=1&pos=12
NEW YORK TIMES	2013/08/01	2013/08/04	NY SPORTS	What Conference Are We Again?	Dave Caldwell	Aug. 4, 2013 8:08 pm ET	Scarlet Knights switch to the American Athletic Conference this season.	https://www.wsj.com/articles/SB10001424127887323997004578642482347777820?mod=searchresults&page=1&pos=13
NEW YORK TIMES	2013/08/01	2013/08/04	BUSINESS	Meatpackers Await Signs Beef Is Back	Jesse Newman	Aug. 4, 2013 7:51 pm ET	Tyson Foods, Hillshire and Cargill are due to report quarterly results that will shed light on whether consumers continue to show a preference for cheaper meats like pork and chicken at the expense of beef.	https://www.wsj.com/articles/SB10001424127887323997004578644162210737772?mod=searchresults&page=1&pos=14
NEW YORK TIMES	2013/08/01	2013/08/04	POLITICS	Judges Extend High Court Same-Sex Ruling	Ashby Jones	Aug. 4, 2013 7:42 pm ET	Judges in lower courts are citing and even building on the U.S. Supreme Court ruling that struck down part of a federal law that defined marriage as a union between a man and a woman.	https://www.wsj.com/articles/SB10001424127887323971204578630261068093272?mod=searchresults&page=1&pos=15
NEW YORK TIMES	2013/08/01	2013/08/04	BUSINESS	Future of Cable Might Not Include TV	Martin Peers, Shalini Ramachandran	Aug. 4, 2013 7:38 pm ET	Cablevision CEO James Dolan says "there could come a day" when his company stops offering television service, making broadband its primary offering.	https://www.wsj.com/articles/SB10001424127887323420604578647961424594702?mod=searchresults&page=1&pos=16
NEW YORK TIMES	2013/08/01	2013/08/04	MEDIA & MARKETING	Old-School Ad Execs Sweat as Data Geeks Flex Muscle	Christopher S. Stewart, Suzanne Vranica	Aug. 4, 2013 7:31 pm ET	Once home to creative minds in the mold of Don Draper and "Mad Men," Madison Avenue is increasingly a bastion of geeks: computer programmers, data heads, quantitative analysts and others with "digital experience."	https://www.wsj.com/articles/SB10001424127887323997004578644220074391246?mod=searchresults&page=1&pos=17
NEW YORK TIMES	2013/08/01	2013/08/04	LAW JOURNAL	Comings & Goings	null	Aug. 4, 2013 7:15 pm ET	Claudius Sokenu, a former federal regulator known for his anticorruption work, is joining Shearman & Sterling.	https://www.wsj.com/articles/SB10001424127887323420604578647901684216298?mod=searchresults&page=1&pos=18
NEW YORK TIMES	2013/08/01	2013/08/04	NEW YORK	Computer Problems Leave Goods Stranded at New York Port	Ted Mann	Aug. 4, 2013 5:59 pm ET	Computer problems at one of the East Coast's biggest ports have snarled the flow of cargo across the Northeast for weeks, delaying the delivery of consumer goods needed for back-to-school sales.	https://www.wsj.com/articles/SB10001424127887323420604578648190833108164?mod=searchresults&page=1&pos=19
NEW YORK TIMES	2013/08/01	2013/08/04	BUSINESS	No Sign of Progress in CBS/Time Warner Cable Dispute	Christopher S. Stewart, Shalini Ramachandran	Aug. 4, 2013 5:59 pm ET	On Sunday, there was no sign of a resolution in the blackout of CBS's flagship network on Time Warner Cable systems in New York, Los Angeles and a few other markets. The two companies couldn't even agree on whether any talks were under way.	https://www.wsj.com/articles/SB10001424127887324136204578646243072251584?mod=searchresults&page=1&pos=20
SL GREEN REALTY	2015/07/22	2015/07/25	NY REAL ESTATE COMMERCIAL	NYC Construction Workers Hurt During Demolition for Office Block	Kate King	July 24, 2015 8:22 pm ET	Two workers were taken to a hospital after an accident at a New York City building site, the scene of a proposed office complex.	https://www.wsj.com/articles/construction-workers-hurt-after-partial-ceiling-collapse-in-midtown-manhattan-1437758545?mod=searchresults&page=1&pos=1
BAKER HUGHES	2017/07/28	2017/07/31	ECONOMY	U.S. Economy Glides Back to Steady, Modest Growth Path	Jeffrey Sparshott	July 28, 2017 4:58 pm ET	The U.S. entered the ninth year of economic expansion in steady but unspectacular fashion that shows little sign of abating.	https://www.wsj.com/articles/u-s-gdp-advanced-2-6-in-second-quarter-1501245395?mod=searchresults&page=1&pos=1
BAKER HUGHES	2017/07/28	2017/07/31	COMMODITIES	Oil Gains on OPEC Cuts, Rising Demand	Timothy Puko	July 28, 2017 3:43 pm ET	Oil prices rose every day this week, their best since December, as renewed optimism about falling supply and rising demand refuel a rally.	https://www.wsj.com/articles/oil-gains-ahead-of-u-s-rig-count-data-1501237839?mod=searchresults&page=1&pos=2
BAKER HUGHES	2017/07/28	2017/07/31	OIL MARKETS	U.S. Oil Rig Count Rises by Two	Ali Stratton	July 28, 2017 1:51 pm ET	The number of rigs drilling for oil in the U.S. rose by two in the past week to 766, according to oil-field services company Baker Hughes, now a unit of General Electric Co.	https://www.wsj.com/articles/u-s-oil-rig-count-rises-by-two-1501264275?mod=searchresults&page=1&pos=3
CINEMARK	2016/02/24	2016/02/27	EARNINGS	Cinemark Reports Better-Than-Expected Profit, Boosts Dividend	Joshua Jamerson	Feb. 24, 2016 7:00 am ET	Cinemark Holdings reported better-than-expected profit for the fourth quarter as it logged attendance growth at its movie theater chain, and the company raised its quarterly dividend.	https://www.wsj.com/articles/cinemark-reports-better-than-expected-profit-boosts-dividend-1456315202?mod=searchresults&page=1&pos=1
ARCHER DANIELS	2016/08/02	2016/08/05	LOGISTICS REPORT	Today’s Top Supply Chain and Logistics News From WSJ	Paul Page	Aug. 3, 2016 5:43 am ET	Delivering up-to-the minute news, analysis, interviews and explanatory journalism on logistics, supply-chain management, e-commerce and more	https://www.wsj.com/articles/todays-top-supply-chain-and-logistics-news-from-wsj-1470217427?mod=searchresults&page=1&pos=1
ARCHER DANIELS	2016/08/02	2016/08/05	EARNINGS	Archer Daniels Midland Expects to Benefit From Bumper Crops, Dollar	Jacob Bunge	Aug. 2, 2016 12:12 pm ET	Commodities giant Archer Daniels Midland Co. projected a bumper North American corn and soybean crop and said a more-stable U.S. dollar would help revive grain-trading profit after second-quarter profit fell.	https://www.wsj.com/articles/archer-daniels-midland-misses-views-but-sees-improving-market-1470139582?mod=searchresults&page=1&pos=2
BAKER HUGHES GE	2017/10/20	2017/10/23	BUSINESS	Big Oil Set for Bumper Profits Despite Cheap Crude	Christopher M. Matthews	Oct. 21, 2017 7:00 am ET	When some of the world’s largest energy companies report earnings next week, it will provide a glimpse into whether they are improving profitability as oil prices continue to hover around $50 a barrel.	https://www.wsj.com/articles/big-oil-set-for-bumper-profits-despite-cheap-crude-1508583603?mod=searchresults&page=1&pos=1
BAKER HUGHES GE	2017/10/20	2017/10/23	EARNINGS	New GE Chief Slashes Forecasts, Plans to Exit $20 Billion in Businesses	Thomas Gryta	Oct. 20, 2017 6:40 pm ET	GE’s quarterly earnings fell as it incurred hefty restructuring charges during CEO John Flannery’s first official quarter at the helm, and the new CEO pledged to exit more than $20 billion of the company’s businesses.	https://www.wsj.com/articles/ge-earnings-fall-as-new-leadership-picks-up-restructuring-work-1508497764?mod=searchresults&page=1&pos=2
TIME WARNER	2013/05/01	2013/05/04	ASIAN BUSINESS NEWS	Uncle Sam Helps Indie-Rock Bands Drum Up Fans Abroad	Hannah Karp	May 3, 2013 7:18 pm ET	The U.S. government's trade arm is stepping in to help the music business, funding trade missions to Brazil and Asia for the heads of independent music labels.	https://www.wsj.com/articles/SB10001424127887324582004578457490606789014?mod=searchresults&page=1&pos=1
TIME WARNER	2013/05/01	2013/05/04	BUSINESS	Glencore Xstrata CEO: Expect Big Layoffs	Alex MacDonald, John W. Miller	May 3, 2013 10:27 am ET	As Glencore Xstrata shares start trading Friday, CEO Ivan Glasenberg's focus is on integrating the two firms, squeezing out every ounce of profit, and watching for the next deal.	https://www.wsj.com/articles/SB10001424127887324766604578458910329071572?mod=searchresults&page=1&pos=2
TIME WARNER	2013/05/01	2013/05/04	BEST OF THE WEB	The Excuse Factory	James Taranto	May 3, 2013 12:01 am ET	How--and why--the liberal media have coddled Obama.	https://www.wsj.com/articles/SB10001424127887323628004578461052617922138?mod=searchresults&page=1&pos=3
TIME WARNER	2013/05/01	2013/05/04	BUSINESS	Hollywood Risks Glut This Summer	Ben Fritz	May 2, 2013 9:10 pm ET	A sharp drop-off in attendance has raised the stakes for Hollywood's summer season. With 50% more big-budget extravaganzas coming out, each film will have a tougher time grabbing its piece of the pie.	https://www.wsj.com/articles/SB10001424127887324582004578459133431601360?mod=searchresults&page=1&pos=4
TIME WARNER	2013/05/01	2013/05/04	ARTS & ENTERTAINMENT	Jay-Z, 3-D and Jay Gatsby	Rachel Dodes	May 2, 2013 6:43 pm ET	At New York's Plaza Hotel, the setting of the book's violent climax, the 50-year-old Australian director ("Strictly Ballroom," "Moulin Rouge") talked about his latest project.	https://www.wsj.com/articles/SB10001424127887323528404578454703210643978?mod=searchresults&page=1&pos=5
TIME WARNER	2013/05/01	2013/05/04	EARNINGS	Kellogg Expects Costs to Ease	Paul Ziobro	May 2, 2013 2:13 pm ET	Kellogg expects costs for grains and other ingredients to fall in the second half of the year versus where they were in 2012, providing some relief. First-quarter profits were down 11%.	https://www.wsj.com/articles/SB10001424127887324766604578458583809317740?mod=searchresults&page=1&pos=6
TIME WARNER	2013/05/01	2013/05/04	EARNINGS	Pay-TV Fees Lift Media Firms	Amol Sharma	May 1, 2013 7:23 pm ET	Big media firms are relying more on growth in the fees they get from pay-TV distributors to offset a tepid and uncertain advertising market, a trend highlighted Wednesday in their quarterly results.	https://www.wsj.com/articles/SB10001424127887324582004578457290620654204?mod=searchresults&page=1&pos=7
TIME WARNER	2013/05/01	2013/05/04	MEDIA & MARKETING	DreamWorks to Buy AwesomenessTV	Saabira Chaudhuri	May 1, 2013 5:35 pm ET	DreamWorks Animation has agreed to acquire YouTube teen network AwesomenessTV for $33 million, another instance of a traditional media company expanding its digital footprint.	https://www.wsj.com/articles/SB10001424127887324766604578456763440901712?mod=searchresults&page=1&pos=8
TIME WARNER	2013/05/01	2013/05/04	HEARD ON THE STREET	The High Cost of Keeping Time Warner in Czech	John Jannarone	May 1, 2013 2:36 pm ET	Time Warner has quietly poured a small fortune into Eastern European television. But it doesn't have much to show for it.	https://www.wsj.com/articles/SB10001424127887324582004578457033497737270?mod=searchresults&page=1&pos=9
TIME WARNER	2013/05/01	2013/05/04	NY SPORTS	Remembering the Late, Great USFL	Jeff Pearlman	May 1, 2013 11:51 am ET	Thirty years ago, the United States Football League took on the mighty NFL. Then zany complications ensued.	https://www.wsj.com/articles/SB10001424127887324482504578454893490665504?mod=searchresults&page=1&pos=10
TIME WARNER	2013/05/01	2013/05/04	EARNINGS	Comcast Video Revenue Up, Despite Subscriber Losses	Shalini Ramachandran	May 1, 2013 11:11 am ET	Comcast's first-quarter profit increased 17% as the company reported a rise in subscribers at its voice and high-speed Internet businesses, helping to stem losses of video customers.	https://www.wsj.com/articles/SB10001424127887324766604578456523237496746?mod=searchresults&page=1&pos=11
TIME WARNER	2013/05/01	2013/05/04	EARNINGS	Clorox Sales Hurt by Fizzling Charcoal	Paul Ziobro	May 1, 2013 10:27 am ET	Clorox's fiscal third-quarter earnings inched up 0.8% but sales growth slowed as cold March weather curbed sales of its Kingsford charcoal brand.	https://www.wsj.com/articles/SB10001424127887324766604578456731043616840?mod=searchresults&page=1&pos=12
TIME WARNER	2013/05/01	2013/05/04	EARNINGS	Time Warner Earnings: TV Networks Provide Boost	Melodie Warner	May 1, 2013 9:30 am ET	Time Warner's quarterly earnings rose 23% as stronger network revenue helped offset declines for publishing and film-and-television entertainment.	https://www.wsj.com/articles/SB10001424127887323628004578456653797237908?mod=searchresults&page=1&pos=13
TIME WARNER	2013/05/01	2013/05/04	BEST OF THE WEB	Too Weak to Surrender	James Taranto	May 1, 2013 12:01 am ET	Obama promises terrorists he'll try hard to meet their demands.	https://www.wsj.com/articles/SB10001424127887323628004578457001748448248?mod=searchresults&page=1&pos=14
GENERAL MOTORS	2016/04/21	2016/04/24	HEARD ON THE STREET	Why Mitsubishi Motors’ Crash Assessment Doesn’t Look Good	Abheek Bhattacharya	April 24, 2016 8:19 pm ET	Mitsubishi’s shares haven’t really become a bargain—even under the generous scenario that the scandal is contained to what the company has so far outlined.	https://www.wsj.com/articles/why-mitsubishi-motors-crash-assessment-doesnt-look-good-1461481385?mod=searchresults&page=1&pos=1
GENERAL MOTORS	2016/04/21	2016/04/24	NY AP TOP NEWS	NYC primary voter complaints draw investigations, suspension	null	April 23, 2016 10:14 am ET	NEW YORK — Even before the polls closed in New York's primary, the city's election board dismissed as groundless hundreds of complaints, many from people in Bernie Sanders' hometown borough of Brooklyn who said they were unable to vote.	https://www.wsj.com/articles/APae33ef49e113428482b51cbb8535c9fb?mod=searchresults&page=1&pos=2
GENERAL MOTORS	2016/04/21	2016/04/24	ASIAN BUSINESS NEWS	Foreign and Domestic SUVs to Face Off at Beijing Auto Show	null	April 23, 2016 8:28 am ET	Foreign firms that have felt the sales impact of not having a stronger SUV portfolio in China are expected to unveil new models when the motor show opens Monday.	https://www.wsj.com/articles/foreign-and-domestic-suvs-to-face-off-at-beijing-auto-show-1461294837?mod=searchresults&page=1&pos=3
