INDEPENDENT BANK	2018/01/18	2018/01/21	MARKETS	Listed Chinese Firms Bought $192 Billion Worth of Opaque Investment Products in 2017	null	Jan. 21, 2018 9:38 pm ET	Chinese companies are buying more high-yielding investment products that are sold by banks to raise funds and boost lending, a potentially troubling sign for China’s debt-fueled economy.	https://www.wsj.com/articles/chinese-firms-load-up-on-opaque-investment-products-1516532400?mod=searchresults&page=1&pos=1
INDEPENDENT BANK	2018/01/18	2018/01/21	U.S.	Women March as Politics, Equal Rights Dominate Discussion	Jennifer Levitz, Lalita Clozel, Zolan Kanno-Youngs	Jan. 20, 2018 7:22 pm ET	Hundreds of events this weekend to mark the one-year anniversary of women’s march demonstrations against President Donald Trump aim to channel the momentum into a new mandate to influence electoral politics.	https://www.wsj.com/articles/anniversary-of-womens-march-brings-new-mandate-get-out-to-vote-1516449601?mod=searchresults&page=1&pos=2
INDEPENDENT BANK	2018/01/18	2018/01/21	WORLD	Economist Proposed as First Woman on Bank of Mexico Board	Juan Montes	Jan. 18, 2018 11:31 pm ET	Mexican President Enrique Peña Nieto has proposed Irene Espinosa, an economist and senior finance ministry official, as a deputy governor of the central bank.	https://www.wsj.com/articles/economist-proposed-as-first-woman-on-bank-of-mexico-board-1516336268?mod=searchresults&page=1&pos=3
INDEPENDENT BANK	2018/01/18	2018/01/21	EUROPE	European Union Confronts Deep Divisions Over Legal Standards	Daniel Michaels, Valentina Pop	Jan. 18, 2018 5:30 am ET	The European Union is locked in increasingly bitter battles with its newer members over their adherence to democratic standards of law, a clash of cultures that EU officials say poses a long-term threat to the union.	https://www.wsj.com/articles/european-union-confronts-deep-divisions-over-legal-standards-1516271401?mod=searchresults&page=1&pos=4
DUKE ENERGY	2014/11/05	2014/11/08	NY CULTURE	Ideology and Art From the Heart of Brooklyn	Peter Plagens	Nov. 7, 2014 8:04 pm ET	Art review: ‘Crossing Brooklyn,’ at the Brooklyn Museum, showcases works from artists including Duke Riley, Miguel Luciano and Mary Mattingly.	https://www.wsj.com/articles/ideology-and-art-from-the-heart-of-brooklyn-1415408688?mod=searchresults&page=1&pos=1
DUKE ENERGY	2014/11/05	2014/11/08	EARNINGS	Duke Energy Revenue Edges Up	Angela Chen	Nov. 5, 2014 8:02 am ET	Duke Energy said its third-quarter revenue edged up 2.9%, though earnings were hurt by unfavorable weather, along with plant outages and higher costs in Latin America.	https://www.wsj.com/articles/duke-energy-revenue-edges-up-1415192531?mod=searchresults&page=1&pos=2
AFLAC	2016/07/28	2016/07/31	MARKETS	Aflac Operating Profit Rises 8.6% With Help From Stronger Yen	Tess Stynes	July 28, 2016 5:30 pm ET	Aflac Inc. said its second-quarter operating earnings rose 8.6% as a stronger yen benefited the insurer’s business in Japan, where the company generates most of its sales.	https://www.wsj.com/articles/aflac-operating-profit-rises-8-6-with-help-from-stronger-yen-1469741424?mod=searchresults&page=1&pos=1
BERKSHIRE HILLS	2018/01/25	2018/01/28	U.S.	Fight at Berkshire Museum Doesn’t Look Like a Norman Rockwell Painting	Jennifer Levitz	Jan. 28, 2018 11:34 am ET	Plans by a Berkshires, Massachusetts, museum to auction some of Norman Rockwell's work to raise millions of dollars is dividing the community where he lived and worked.	https://www.wsj.com/articles/fight-at-berkshire-museum-doesnt-look-like-a-norman-rockwell-painting-1517157253?mod=searchresults&page=1&pos=1
BERKSHIRE HILLS	2018/01/25	2018/01/28	HOMES	House of the Year: A Windswept Ranch	null	Jan. 25, 2018 12:01 am ET	A sprawling Montana ranch still on the market for $12 million was the reader favorite in the WSJ’s annual House of the Year contest.	https://www.wsj.com/articles/house-of-the-year-a-windswept-ranch-1516892619?mod=searchresults&page=1&pos=2
INTUIT	2014/02/20	2014/02/23	U.S. MARKETS	U.S. Stocks Close Lower	Matt Jarzemsky	Feb. 21, 2014 4:39 pm ET	U.S. stocks edged lower Friday, with the S&P 500 posting a weekly loss and snapping a two-week winning streak.	https://www.wsj.com/articles/SB10001424052702304914204579396730070427424?mod=searchresults&page=1&pos=1
INTUIT	2014/02/20	2014/02/23	EARNINGS	Intuit Swings To Loss as Revenue Slips Amid Late Tax Season Start	Anna Prior	Feb. 20, 2014 4:45 pm ET	Intuit posts fiscal second-quarter loss as the tax software company recorded a drop in revenue tied to a late start to the tax season.	https://www.wsj.com/articles/SB10001424052702304914204579395422210420300?mod=searchresults&page=1&pos=2
HERITAGE FINANCIAL	2017/10/26	2017/10/29	JOURNAL REPORTS: LEADERSHIP	De Beers Faces Tricky Task of Selling Diamonds to Millennials	Tatyana Shumsky	Oct. 29, 2017 10:02 pm ET	CFO Nimesh Patel says the company is changing its message to appeal to a younger consumer.	https://www.wsj.com/articles/de-beers-faces-tricky-task-of-selling-diamonds-to-millennials-1509328920?mod=searchresults&page=1&pos=1
APPLE	2013/10/28	2013/10/31	FOOD & DRINK	Quince Is a Fall Fruit Worth Waiting For	Gail Monaghan	Oct. 31, 2013 9:53 pm ET	In recipes for everything from fruit crostata to gingery chutney, slow cooking renders tart, firm quince sweet, succulent and irresistible.	https://www.wsj.com/articles/SB10001424052702303680404579143802640881062?mod=searchresults&page=1&pos=1
APPLE	2013/10/28	2013/10/31	BOOKSHELF	Book Review: 'Hatching Twitter' by Nick Bilton	null	Oct. 31, 2013 7:10 pm ET	If Twitter programmer Noah Glass's marriage wasn't unraveling, he might not have designed a product to make people feel less alone. David Shaywitz reviews Nick Bilton's "Hatching Twitter."	https://www.wsj.com/articles/SB10001424052702303618904579168562242433546?mod=searchresults&page=1&pos=2
APPLE	2013/10/28	2013/10/31	JAPAN	SoftBank Plays Up Smartphone Games	null	Oct. 31, 2013 1:01 pm ET	CEO Masayoshi Son plans to make SoftBank No. 1 in smartphone games as it aims to be the world's top mobile Internet concern.	https://www.wsj.com/articles/SB10001424052702303618904579168750208316152?mod=searchresults&page=1&pos=3
APPLE	2013/10/28	2013/10/31	NY REGION	Marathon Evolves in Era of Tighter Security	Josh Dawsey	Oct. 31, 2013 10:49 am ET	Security will be tighter than in years past for this weekend's New York City Marathon, the city's first since the deadly terrorist bombing last spring at the Boston marathon.	https://www.wsj.com/articles/SB10001424052702303618904579167921893663140?mod=searchresults&page=1&pos=4
APPLE	2013/10/28	2013/10/31	ASIA TECHNOLOGY	Hon Hai Makes Push Into Software Development, Telecom Services	Lorraine Luk	Oct. 31, 2013 8:21 am ET	In a strategy shift, Hon Hai Precision Industry is making a push into software development and telecom services, its latest efforts to seek new avenues of growth as revenue from contract manufacturing slows.	https://www.wsj.com/articles/SB10001424052702304527504579169323097728660?mod=searchresults&page=1&pos=5
APPLE	2013/10/28	2013/10/31	JAPAN	Sharp Turns Profit on LCD Business Recovery	Hiroyuki Kachi	Oct. 31, 2013 8:14 am ET	Under heavy scrutiny to prove it has the power to revive itself, Sharp Corp. said it swung into a net profit for the first time in nearly two years thanks to improved profitability at its liquid crystal display business.	https://www.wsj.com/articles/SB10001424052702304073204579169292526562828?mod=searchresults&page=1&pos=6
APPLE	2013/10/28	2013/10/31	BEST OF THE WEB	President Haze	James Taranto	Oct. 31, 2013 12:01 am ET	Obama and his supporters emit a fog of equivocation and euphemism.	https://www.wsj.com/articles/SB10001424052702304073204579169711152265686?mod=searchresults&page=1&pos=7
APPLE	2013/10/28	2013/10/31	MARKETS	Earlier Nasdaq Glitch Cued Talk, No Action	Jacob Bunge	Oct. 30, 2013 8:14 pm ET	U.S. stock-market officials and regulators earlier this year may have missed a chance to head off problems related to an August glitch that stopped trading in Nasdaq Stock Market-listed securities for hours.	https://www.wsj.com/articles/SB10001424052702303843104579168132805871354?mod=searchresults&page=1&pos=8
APPLE	2013/10/28	2013/10/31	POLITICS	Obama Tempers Insurance Pledge as Health Fight Rages	Colleen McCain Nelson, Peter Nicholas	Oct. 30, 2013 7:56 pm ET	Obama said Americans who are losing insurance under the health law would find better coverage, rebutting a rising chorus of complaints that he had oversold the law's benefits.	https://www.wsj.com/articles/SB10001424052702303843104579168141838969798?mod=searchresults&page=1&pos=9
APPLE	2013/10/28	2013/10/31	FOOD & DRINK	Halloween Candy Goes Gourmet	Cecilie Rohwedder	Oct. 30, 2013 7:13 pm ET	New sweets test boundaries for Halloween and beyond. Would you like your candy in açai, beef jerky or d'Anjou pear?	https://www.wsj.com/articles/SB10001424052702304527504579167581690397474?mod=searchresults&page=1&pos=10
APPLE	2013/10/28	2013/10/31	SPORTS	Are Europeans Faster Than Americans?	Kevin Helliker	Oct. 30, 2013 7:04 pm ET	Ahead of Sunday's New York Marathon: Are Europeans just faster than Americans?	https://www.wsj.com/articles/SB10001424052702303843104579167990306130098?mod=searchresults&page=1&pos=11
APPLE	2013/10/28	2013/10/31	HIGH DEFINITION	High Tech's Secret Weapon: The Whiteboard	Farhad Manjoo	Oct. 30, 2013 5:52 pm ET	Whiteboards, as technologically backward as they may seem, are to Silicon Valley what legal pads are to lawyers, what Excel is to accountants, or what long sleeves are to magicians. They're an all-purpose tool of innovation, writes Farhad Manjoo.	https://www.wsj.com/articles/SB10001424052702303843104579167953416484032?mod=searchresults&page=1&pos=12
APPLE	2013/10/28	2013/10/31	ASIA MARKETS	Rally in China Internet Stocks Begins to Stall	Mia Lamar	Oct. 30, 2013 5:45 pm ET	Investors begin to take profits after months of big gains push valuations to lofty levels.	https://www.wsj.com/articles/SB10001424052702304073204579167242879885558?mod=searchresults&page=1&pos=13
APPLE	2013/10/28	2013/10/31	BUSINESS	Nokia to Seek U.K. HTC Sales Ban	Sven Grundberg	Oct. 30, 2013 12:25 pm ET	The Finnish company will seek financial compensation and a sales ban on mobile devices made by HTC in the U.K. after winning patent dispute.	https://www.wsj.com/articles/SB10001424052702304527504579167574293651640?mod=searchresults&page=1&pos=14
APPLE	2013/10/28	2013/10/31	WEALTH ADVISER	Income-Hungry Investors Turn to Stock Options	Murray Coleman	Oct. 30, 2013 9:45 am ET	Investors on the hunt for yield are dipping into a stock-options strategy known as "covered-call writing." But some advisers warn that such strategies aren't a good substitute to earn extra income.	https://www.wsj.com/articles/SB10001424052702304073204579167440703637858?mod=searchresults&page=1&pos=15
EMPLOYERS	2017/10/25	2017/10/28	MOBILEDECOQUIZ
January Jobs Report Expected to Show Pickup in Hiring
Oct. 25, 2017 11:41 am ET
EMPLOYERS	2017/10/25	2017/10/28	EDUCATION	College Costs Continue to Edge Higher	Melissa Korn	Oct. 25, 2017 12:01 am ET	College continues to get more expensive for students and for schools that are shelling out grant money to attract students.	https://www.wsj.com/articles/college-costs-continue-to-edge-higher-1508904060?mod=searchresults&page=1&pos=16
TOLL BROTHERS	2015/02/24	2015/02/27	ECONOMY	U.S. New Home Sales Edge Lower	Jeffrey Sparshott, Kris Hudson	Feb. 25, 2015 11:07 am ET	New-home sales fell slightly in January but the overall pace remained near a six-year high, a sign of strong demand that could help boost the broader U.S. housing market.	https://www.wsj.com/articles/u-s-new-home-sales-at-481-000-pace-in-january-1424876627?mod=searchresults&page=1&pos=1
TOLL BROTHERS	2015/02/24	2015/02/27	U.S. MARKETS	U.S. Stocks Rise to Fresh Records	Dan Strumpf, Saumya Vaishampayan	Feb. 24, 2015 4:35 pm ET	The Dow industrials and S&P 500 closed at fresh records Tuesday after Fed Chairwoman Janet Yellen signaled that future interest-rate increases will be clearly marked and noted the recent improvement in the U.S. economy.	https://www.wsj.com/articles/u-s-stock-futures-flat-ahead-of-yellen-testimony-1424783872?mod=searchresults&page=1&pos=2
TOLL BROTHERS	2015/02/24	2015/02/27	EARNINGS	Toll Brothers Profit Nearly Doubles as Demand Improves	Chelsey Dulaney	Feb. 24, 2015 8:05 am ET	Toll Brothers said its profit nearly doubled in its January quarter, as job growth and other economic improvements boost demand for the luxury home builder.	https://www.wsj.com/articles/toll-brothers-profit-nearly-doubles-as-demand-improves-1424778344?mod=searchresults&page=1&pos=3
PG&E	2013/07/31	2013/08/03	BEST OF THE WEB	Scenes From a Shoving	James Taranto	Aug. 2, 2013 12:01 am ET	Johnny Paycheck costs Johnson his paycheck.	https://www.wsj.com/articles/SB10001424127887324136204578643982827602900?mod=searchresults&page=1&pos=1
QUEST DIAGNOSTIC	2015/04/23	2015/04/26	EARNINGS	Quest Diagnostics Revenue Grows 5.3% as Business Environment Improves	Chelsey Dulaney	April 23, 2015 8:03 am ET	Quest Diagnostics said that revenue grew 5.3% in its first quarter as the labratory-testing company benefits from growth in its diagnostics business and an improving environment.	https://www.wsj.com/articles/quest-diagnostics-revenue-grows-5-3-as-business-environment-improves-1429790614?mod=searchresults&page=1&pos=1
VERIZON COMMUNICATIONS	2015/07/21	2015/07/24	BLOG: MONEY INVESTING	Big Funds: Do They Hurt Your Wallet?	Jason Zweig	July 24, 2015 9:30 pm ET	If it seems like your airplane tickets cost too much this summer or your bank is overcharging you at the ATM, you might think about blaming your mutual fund.	https://www.wsj.com/articles/big-funds-do-they-hurt-your-wallet-1437787847?mod=searchresults&page=1&pos=1
VERIZON COMMUNICATIONS	2015/07/21	2015/07/24	BUSINESS	Comcast in Talks With Multiple New-Media Firms	Amol Sharma, Liz Hoffman, Shalini Ramachandran	July 23, 2015 6:34 pm ET	Comcast’s NBCUniversal is scouting out several companies in the world of new media for potential deals, looking for access to young TV cord-cutters.	https://www.wsj.com/articles/comcast-in-talks-with-multiple-new-media-firms-1437690882?mod=searchresults&page=1&pos=2
VERIZON COMMUNICATIONS	2015/07/21	2015/07/24	NY AP TOP NEWS	NY attorney general, others urges call blocking on phones	null	July 22, 2015 12:46 pm ET	ALBANY, N.Y. — New York's attorney general has joined counterparts from 44 other states in calling on five major phone companies to offer call-blocking technology to customers to help stop robocalls.	https://www.wsj.com/articles/AP477a27d2bac84fc5b84045661845e033?mod=searchresults&page=1&pos=3
VERIZON COMMUNICATIONS	2015/07/21	2015/07/24	TECH	Verizon’s Growth Slows, as It Leans on Tablets	Chelsey Dulaney, Ryan Knutson	July 21, 2015 11:40 pm ET	Verizon’s mainstream wireless subscriber growth slowed, and revenue came in below forecasts. Tablets accounted for 852,000 of the 1.1 million net subscriber additions.	https://www.wsj.com/articles/verizon-earnings-edge-higher-1437479230?mod=searchresults&page=1&pos=4
VERIZON COMMUNICATIONS	2015/07/21	2015/07/24	U.S. MARKETS	Dow Gets ‘Big Blues,’ Weighed Down by IBM, United Technologies	Corrie Driebusch, Saumya Vaishampayan	July 21, 2015 6:42 pm ET	U.S. stocks fell Tuesday after weak earnings reports from International Business Machines and United Technologies dragged down the Dow Jones Industrial Average.	https://www.wsj.com/articles/u-s-stock-futures-mixed-1437481110?mod=searchresults&page=1&pos=5
VERIZON COMMUNICATIONS	2015/07/21	2015/07/24	TECH	FCC Poised to Approve AT&T’s $49 Billion Acquisition of DirecTV	Thomas Gryta	July 21, 2015 5:12 pm ET	Federal regulators are poised to approve AT&T’s $49 billion acquisition of DirecTV, clearing the way for the biggest media deal of the past year.	https://www.wsj.com/articles/fcc-poised-to-approve-at-ts-49-billion-acquisition-of-directv-1437511631?mod=searchresults&page=1&pos=6
VERIZON COMMUNICATIONS	2015/07/21	2015/07/24	HEARD ON THE STREET	Verizon Feels AT&T’s Pain	Miriam Gottfried	July 21, 2015 3:32 pm ET	Verizon’s quarterly results suggest it is experiencing similar discount-driven pain to what AT&T endured last year.	https://www.wsj.com/articles/verizon-feels-at-ts-pain-1437507135?mod=searchresults&page=1&pos=7
VERIZON COMMUNICATIONS	2015/07/21	2015/07/24	NY AP TOP NEWS	Verizon tops 2Q profit forecasts	null	July 21, 2015 10:26 am ET	NEW YORK — Verizon Communications Inc. on Tuesday reported second-quarter earnings that topped analyst expectations as it signed up more wireless customers.	https://www.wsj.com/articles/AP8240d62937ba799571f695e1890a8976?mod=searchresults&page=1&pos=8
SIMULATIONS PLUS	2013/01/15	2013/01/18	EUROPE
IMF: Greece Needs More Help From Euro Partners
By Costas Paris Jan. 18, 2013 12:33 pm ET
BANK OF NEW YORK MELLON	2014/01/17	2014/01/20	MARKETS	Bank of New York Mellon Profit Falls as Expenses Rise	Everdeen Mason, Julie Steinberg	Jan. 17, 2014 11:33 pm ET	Bank of New York Mellon Corp.'s fourth-quarter profit fell 15% and missed analyst expectations as investment charges and rising expenses offset improved market conditions and growth in assets.	https://www.wsj.com/articles/SB10001424052702304419104579326681622219124?mod=searchresults&page=1&pos=1
AMERICAN VANGUARD	2018/03/12	2018/03/15	BOOKSHELF	‘A Foreign Policy for the Left’ Review: Can There Be a ‘Decent’ Left?	Martin Peretz	March 14, 2018 6:59 pm ET	The editor of Dissent magazine asks his comrades for a more nuanced moral response to America’s use of power abroad. Martin Peretz reviews ‘A Foreign Policy for the Left’ by Michael Walzer.	https://www.wsj.com/articles/a-foreign-policy-for-the-left-review-can-there-be-a-decent-left-1521068399?mod=searchresults&page=1&pos=1
LA-Z-BOY	2013/08/20	2013/08/23	EARNINGS	Home Depot's Earnings Rise 17%	Shelly Banjo	Aug. 20, 2013 4:01 pm ET	Home Depot's fiscal-second-quarter earnings jumped 17% as the retailer continued to benefit from an improving housing market.	https://www.wsj.com/articles/SB10001424127887324747104579024361187645796?mod=searchresults&page=1&pos=1
CITIGROUP	2015/10/15	2015/10/18	MARKETS	Credit Suisse Overhaul Could Mirror Local Rival, UBS	John Letzing, Margot Patrick	Oct. 18, 2015 6:59 pm ET	Clues about how Credit Suisse’s chief executive plans to overhaul the bank may lie just down the road at its biggest rival, UBS.	https://www.wsj.com/articles/credit-suisse-overhaul-could-mirror-local-rival-ubs-1444999285?mod=searchresults&page=1&pos=1
CITIGROUP	2015/10/15	2015/10/18	COMMODITIES	Chinese Copper-Trading Surge Shakes Up Market	Tatyana Shumsky	Oct. 18, 2015 2:55 pm ET	Chinese investors hamstrung by stock-trading restrictions are piling into copper trading, a shift that analysts and traders say has distorted the global market for the metal.	https://www.wsj.com/articles/chinese-copper-trading-surge-shakes-up-market-1445194548?mod=searchresults&page=1&pos=2
CITIGROUP	2015/10/15	2015/10/18	MARKETS	Citigroup Adds New Unit With Mobile Focus	Anne Steele	Oct. 16, 2015 10:43 am ET	Citigroup said that it is establishing a new unit in its global consumer bank charged with building a smartphone-centric “bank of tomorrow.”	https://www.wsj.com/articles/citigroup-adds-new-unit-with-mobile-focus-1445006618?mod=searchresults&page=1&pos=3
GOLDMAN SACHS GROUP	2017/01/18	2017/01/21	MARKETS	China Oceanwide Consortium Clinches Deal to Buy International Data Group	Rick Carew	Jan. 19, 2017 11:23 pm ET	A team led by China Oceanwide Holdings reached a deal to buy International Data Group, the data and marketing company that also runs venture-capital firm IDG Ventures.	https://www.wsj.com/articles/china-oceanwide-consortium-clinches-deal-to-buy-international-data-group-1484883893?mod=searchresults&page=1&pos=7
GOLDMAN SACHS GROUP	2017/01/18	2017/01/21	U.S. MARKETS	Dow Falls for Fifth Straight Session	Akane Otani	Jan. 19, 2017 5:43 pm ET	The Dow Jones Industrial Average fell, putting the index in negative territory for the year.	https://www.wsj.com/articles/european-stocks-steady-ahead-of-ecb-meeting-1484816024?mod=searchresults&page=1&pos=8
GOLDMAN SACHS GROUP	2017/01/18	2017/01/21	DAVOS	U.K.’s Theresa May Meets With Wall Street Bank Chiefs	Max Colchester, Nicholas Winning	Jan. 19, 2017 3:07 pm ET	U.K. Prime Minister Theresa May met with the chief executives of several Wall Street banks, following further warnings by lenders that they would shift jobs out of London to continental Europe after Brexit.	https://www.wsj.com/articles/u-k-s-may-meets-with-wall-street-bank-chiefs-1484851096?mod=searchresults&page=1&pos=9
GOLDMAN SACHS GROUP	2017/01/18	2017/01/21	POLITICS	Steven Mnuchin, Donald Trump’s Treasury Pick, to Address IndyMac Questions at Confirmation Hearing	Nick Timiraos	Jan. 19, 2017 5:30 am ET	Investments tied to the foreclosure crisis are shaping up to figure prominently in the confirmation hearing for Steven Mnuchin, Donald Trump’s intended nominee for Treasury secretary.	https://www.wsj.com/articles/steven-mnuchin-donald-trumps-treasury-pick-to-address-indymac-questions-at-confirmation-hearing-1484821810?mod=searchresults&page=1&pos=10
GOLDMAN SACHS GROUP	2017/01/18	2017/01/21	MARKETS	Wall Street Gets Back Its Groove	Christina Rexrode, Liz Hoffman	Jan. 18, 2017 11:59 pm ET	The historic U.S. election jolted Wall Street trading desks, buoying investor confidence and sparking activity that pushed the five biggest U.S. investment banks to sharply higher fourth-quarter profits.	https://www.wsj.com/articles/wall-street-gets-back-its-groove-1484779829?mod=searchresults&page=1&pos=11
GOLDMAN SACHS GROUP	2017/01/18	2017/01/21	U.S. MARKETS	Financial Stocks, Dollar Rebound	Aaron Kuriloff, Jon Sindreu	Jan. 18, 2017 6:58 pm ET	Financial shares, bond yields and the dollar recovered Wednesday, after Fed Chairwoman Janet Yellen signaled steady interest-rate increases for the coming years.	https://www.wsj.com/articles/stocks-steady-trump-inauguration-anticipation-holds-sway-1484729658?mod=searchresults&page=1&pos=12
GOLDMAN SACHS GROUP	2017/01/18	2017/01/21	MARKETS	Goldman Sachs Results Surge on Trading Bounce	Liz Hoffman	Jan. 18, 2017 2:50 pm ET	Goldman Sachs easily beat analyst expectations, turning in a fourth quarter that was among the strongest on Wall Street.	https://www.wsj.com/articles/goldman-sachs-results-beat-estimates-1484743201?mod=searchresults&page=1&pos=13
GOLDMAN SACHS GROUP	2017/01/18	2017/01/21	NY AP TOP NEWS	Citigroup's earnings beat analysts' forecasts	null	Jan. 18, 2017 8:25 am ET	NEW YORK — Financial giant Citigroup reported a 7 percent rise in fourth quarter profits on Wednesday, helped by a strong performance in the bank's trading business, a theme that has repeated itself with all the major Wall Street banks this quarter.	https://www.wsj.com/articles/AP2b0d9b439f08f512a84842a9bd9e80ce?mod=searchresults&page=1&pos=14
FIRST SOLAR	2016/02/23	2016/02/26	THE NUMBERS	Behind the Logic, and Lore, of Leap Day	Jo Craven McGinty	Feb. 26, 2016 8:48 am ET	Columnist Jo Craven McGinty explores the long and winding history of how the modern leap day came to be.	https://www.wsj.com/articles/behind-the-logic-and-lore-of-leap-day-1456498112?mod=searchresults&page=1&pos=1
FIRST SOLAR	2016/02/23	2016/02/26	HISTORICALLY SPEAKING	For Feb. 29, Tales of the Calendar Wars	Amanda Foreman	Feb. 25, 2016 11:13 am ET	Amanda Foreman celebrates Feb. 29, a leap-year anomaly, with a history of calendars and disputes over them.	https://www.wsj.com/articles/for-feb-29-tales-of-the-calendar-wars-1456416800?mod=searchresults&page=1&pos=2
FIRST SOLAR	2016/02/23	2016/02/26	PHOTOS	A Look Back to the Future: Sharp’s Products	null	Feb. 24, 2016 11:44 pm ET	From mechanical pencils to calculators and TVs, some of the products that helped define Sharp in its 103-year history.	https://www.wsj.com/articles/a-look-back-to-the-future-sharps-key-products-1456378446?mod=searchresults&page=1&pos=3
FIRST SOLAR	2016/02/23	2016/02/26	POLITICS	Senators Strike Tentative Deal for Flint Water Crisis Funds	null	Feb. 24, 2016 3:15 pm ET	Senators from both parties—Debbie Stabenow (D., Mich.) and James Inhofe (R., Okla.)—reached a tentative deal to address the water crisis in Flint, Mich.	https://www.wsj.com/articles/senators-strike-tentative-deal-for-flint-water-crisis-funds-1456344939?mod=searchresults&page=1&pos=4
FIRST SOLAR	2016/02/23	2016/02/26	ASIA HOUSE OF THE DAY	Poolside Living in a Melbourne Contemporary	null	Feb. 23, 2016 8:39 pm ET	The focal point of this house is the swimming pool, which also adds a pop of color to the monochrome decorating scheme—Andre Cooray	https://www.wsj.com/articles/poolside-living-in-a-melbourne-contemporary-1456277956?mod=searchresults&page=1&pos=5
FIRST SOLAR	2016/02/23	2016/02/26	EARNINGS	First Solar Results Top Views; Company Cuts Sales Guidance	Maria Armental	Feb. 23, 2016 7:14 pm ET	First Solar Inc. cut its sales guidance for 2016 and reported a sales drop in the December quarter.	https://www.wsj.com/articles/first-solar-results-top-views-company-cuts-sales-guidance-1456265828?mod=searchresults&page=1&pos=6
FIRST SOLAR	2016/02/23	2016/02/26	COMMODITIES	Saudi Oil Minister Says No to Production Cuts	Bill Spindle	Feb. 23, 2016 5:47 pm ET	Saudi Arabia delivered its starkest message yet to a reeling global oil sector, saying it wouldn’t rescue the industry from low prices by cutting its production.	https://www.wsj.com/articles/saudi-oil-minister-production-wont-be-cut-to-reduce-global-supply-glut-1456246011?mod=searchresults&page=1&pos=7
NATIONAL INSTRUMENTS	2013/04/25	2013/04/28	RUMBLE SEAT	Porsche Cayman S: 911's Little Brother Grows Up	Dan Neil	April 26, 2013 3:45 pm ET	You still need a Porsche 911 to test the autobahn's outer limits, but Dan Neil finds the redesigned midengine Cayman a more-than-worthy option for the American road.	https://www.wsj.com/articles/SB10001424127887323735604578441073161189656?mod=searchresults&page=1&pos=1
