BIG LOTS	2016/05/27	2016/05/30	HEALTH	Doctors Test Tools to Predict Your Odds of a Disease	Lucette Lagnado	May 30, 2016 2:46 pm ET	Program aims to calculate the likelihood that a patient has an illness, enabling doctors to order fewer tests and prescribe fewer antibiotics.	https://www.wsj.com/articles/doctors-test-tools-to-predict-your-odds-of-a-disease-1464633980?mod=searchresults&page=1&pos=14
BIG LOTS	2016/05/27	2016/05/30	A-HED	On the Water, Going Around in Circles Sounds Like a Plan	Angus Loten	May 30, 2016 1:23 pm ET	‘Loopers’ pilot boats on inland waterways from Florida up to Quebec, over to the Great Lakes, and down the Illinois and Mississippi rivers to the Gulf Coast, over and over again.	https://www.wsj.com/articles/on-the-water-going-around-in-circles-sounds-like-a-plan-1464629037?mod=searchresults&page=1&pos=15
BIG LOTS	2016/05/27	2016/05/30	NY AP TOP NEWS	Exhibit highlights artillery collection at Fort Ticonderoga	null	May 30, 2016 6:47 am ET	TICONDEROGA, N.Y. — A 1,300-pound hunk of iron on display at Fort Ticonderoga certainly has gotten around, despite its heft.	https://www.wsj.com/articles/AP94a9d0423c174a139e2319f62964793b?mod=searchresults&page=1&pos=16
BIG LOTS	2016/05/27	2016/05/30	PAGE ONE	A First Look at America’s Supergun	Julian E. Barnes	May 30, 2016 1:27 am ET	The Navy’s experimental railgun fires a hardened projectile at staggering velocity—a battlefield meteorite with the power to blow holes in enemy ships and level terrorist camps.	https://www.wsj.com/articles/a-first-look-at-americas-supergun-1464359194?mod=searchresults&page=1&pos=17
BIG LOTS	2016/05/27	2016/05/30	JOURNAL REPORTS: LEADERSHIP	Why the Global Risks for Companies Are Growing	Ben DiPietro	May 30, 2016 12:01 am ET	Marsh CEO Peter Zaffino says one of the main reasons is that we’re all connected.	https://www.wsj.com/articles/why-the-global-risks-for-companies-are-growing-1464660005?mod=searchresults&page=1&pos=18
BIG LOTS	2016/05/27	2016/05/30	THE JOURNAL EDITORIAL REPORT	Inspecting Mrs. Clinton	null	May 29, 2016 11:43 am ET	A transcript of the weekend’s program on FOX News Channel.	https://www.wsj.com/articles/inspecting-mrs-clinton-1464536598?mod=searchresults&page=1&pos=19
BIG LOTS	2016/05/27	2016/05/30	NY AP TOP NEWS	Pineda struggles again as Yankees lose 9-5 to Rays	null	May 28, 2016 9:37 pm ET	ST. PETERSBURG, Fla. — The New York Yankees say they are not yet ready to drop struggling Michael Pineda from their starting rotation.	https://www.wsj.com/articles/AP7500b523da304d9a811e119ecb9f85ec?mod=searchresults&page=1&pos=20
AUTOZONE	2014/03/04	2014/03/07	BUSINESS	AutoZone Profit Rises 9.4% on Higher Revenue, Margins	Tess Stynes	March 4, 2014 7:24 am ET	AutoZone's second-quarter earnings rose 9.4% on revenue growth and stronger margins despite severe winter weather in the U.S.	https://www.wsj.com/articles/SB10001424052702303630904579418783428557544?mod=searchresults&page=1&pos=1
RELIANCE DE	2015/10/22	2015/10/25	ECONOMY	ECB’s Mario Draghi Signals Boost to Stimulus Program	Brian Blackstone, Paul Hannon, Todd Buell	Oct. 22, 2015 4:05 pm ET	European Central Bank President Mario Draghi suggested the bank is prepared to undertake another big stimulus package that could include more bond purchases and a cut to the already negative deposit rate.	https://www.wsj.com/articles/ecb-leaves-interest-rates-unchanged-1445514521?mod=searchresults&page=1&pos=1
S T	2014/10/28	2014/10/31	NY REGION	New Jersey Details Ebola Quarantine Policy	Josh Dawsey	Oct. 31, 2014 10:49 pm ET	New Jersey officials spelled out the state’s quarantine policy, which has been criticized by some health officials but is popular among the public.	https://www.wsj.com/articles/new-jersey-details-ebola-quarantine-policy-1414804720?mod=searchresults&page=1&pos=1
S T	2014/10/28	2014/10/31	BUSINESS	Virgin Galactic Spacecraft Crashes, Killing One	Andy Pasztor, Jon Ostrower	Oct. 31, 2014 10:44 pm ET	A Virgin Galactic rocket ship that was supposed to take the first space tourists next year—starting with billionaire entrepreneur and company founder Richard Branson—exploded during a test flight, killing one pilot.	https://www.wsj.com/articles/virgin-galactic-spaceship-crashes-1414781841?mod=searchresults&page=1&pos=2
EBAY	2018/01/31	2018/02/03	MARKETS	PayPal Loses Big Part of eBay Business	Peter Rudegeair	Jan. 31, 2018 8:34 pm ET	PayPal Holdings said that fourth-quarter profit rose 59%, but the results were overshadowed by news that eBay, one of its biggest sources of customers, plans to replace PayPal as its primary payments processor.	https://www.wsj.com/articles/paypal-profit-rises-59-1517437185?mod=searchresults&page=1&pos=4
EBAY	2018/01/31	2018/02/03	A-HED	It’s the Super Bowl! Why Didn’t I Keep My Nick Foles Jersey?	Andrew Beaton, Andrew Beaton and Ben Cohen, Ben Cohen	Jan. 31, 2018 12:01 pm ET	He was a star quarterback for the Philadelphia Eagles before getting injured and traded; now he’s back—and fans are scrambling to find their No. 9 apparel again.	https://www.wsj.com/articles/its-the-super-bowl-why-didnt-i-keep-my-nick-foles-jersey-1517418059?mod=searchresults&page=1&pos=5
EBAY	2018/01/31	2018/02/03	TECH	EBay Earnings: What to Watch	Laura Stevens	Jan. 31, 2018 5:30 am ET	Ebay reports fourth-quarter earnings after the market closes on Wednesday, and two years of initiatives aimed at improving aspects of eBay’s site are expected to continue to pay off.	https://www.wsj.com/articles/ebay-earnings-what-to-watch-1517394602?mod=searchresults&page=1&pos=6
FOSSIL GROUP	2016/02/16	2016/02/19	BUSINESS	Energy Prices Steer Farmers Away From Manure Power	David Kesmodel	Feb. 18, 2016 12:02 pm ET	The prolonged slump in natural-gas prices has driven farmers to shut down or scrap plans to build manure-to-energy systems known as anaerobic digesters, despite government encouragement.	https://www.wsj.com/articles/energy-prices-steer-farmers-away-from-power-generators-1455814921?mod=searchresults&page=1&pos=1
FOSSIL GROUP	2016/02/16	2016/02/19	EARNINGS	Fossil Group Reports Better-Than-Expected Results	Ezequiel Minaya	Feb. 16, 2016 5:04 pm ET	Fossil Group Inc. reported better-than-expected results for its latest quarter, despite recording drops in sales and earnings in the face of currency headwinds.	https://www.wsj.com/articles/fossil-group-reports-better-than-expected-results-1455660296?mod=searchresults&page=1&pos=2
EMPLOYERS	2017/10/25	2017/10/28	U.S.	Small Town Reclaims Former Mental Hospital as Arts Haven	Shayndi Raice	Oct. 28, 2017 9:00 am ET	Fergus Falls, Minn., turned a sprawling former mental hospital into the focal point of its efforts at renewal using a state-funded embrace of artists and the arts.	https://www.wsj.com/articles/small-town-reclaims-former-mental-hospital-as-arts-haven-1509195600?mod=searchresults&page=1&pos=1
EMPLOYERS	2017/10/25	2017/10/28	BUSINESS	CVS Bid for Aetna Followed a Long Hunt	Anna Wilde Mathews, Dana Mattioli	Oct. 27, 2017 7:37 pm ET	CVS’s bid for Aetna is the culmination of a wide-ranging hunt by the drugstore giant for a deal partner, highlighting a broader effort among health-care companies to find new avenues of growth.	https://www.wsj.com/articles/cvs-bid-for-aetna-followed-a-long-hunt-1509147450?mod=searchresults&page=1&pos=2
EMPLOYERS	2017/10/25	2017/10/28	POLITICS	Trump Administration Relaxes Medical Privacy Rule for Overdoses	Michelle Hackman	Oct. 27, 2017 7:19 pm ET	The Trump Administration announced it is relaxing a federal privacy rule that prevents health providers from notifying family members about a drug overdose, one of the administration’s most significant policy shifts to combat the nation’s opioid crisis.	https://www.wsj.com/articles/trump-administration-relaxes-medical-privacy-rule-for-overdoses-1509146365?mod=searchresults&page=1&pos=3
EMPLOYERS	2017/10/25	2017/10/28	THE WEEKEND INTERVIEW	The Politicization of Motherhood	James Taranto	Oct. 27, 2017 6:40 pm ET	Conservatives cheer and liberals jeer New York psychoanalyst Erica Komisar’s book on the science of early childhood development.	https://www.wsj.com/articles/the-politicization-of-motherhood-1509144044?mod=searchresults&page=1&pos=4
EMPLOYERS	2017/10/25	2017/10/28	BEST OF THE WEB	Resilient America	James Freeman	Oct. 27, 2017 3:39 pm ET	Despite the storms, the U.S. economy posts solid growth.	https://www.wsj.com/articles/resilient-america-1509132758?mod=searchresults&page=1&pos=5
EMPLOYERS	2017/10/25	2017/10/28	BUSINESS	How Would CVS and Aetna Fit Together?	Anna Wilde Mathews, Sharon Terlep	Oct. 27, 2017 2:59 pm ET	What is the potential CVS-Aetna deal all about? A look at what each of these health-care giants would bring to the table, and how the pieces might fit together.	https://www.wsj.com/articles/behind-the-potential-cvs-aetna-deal-1509129970?mod=searchresults&page=1&pos=6
EMPLOYERS	2017/10/25	2017/10/28	JOURNAL REPORTS: LEADERSHIP	Seven TV Shows Every Executive Should Watch	Alexandra Samuel	Oct. 27, 2017 11:06 am ET	Seven shows that every corporate leader should be watching.	https://www.wsj.com/articles/seven-tv-shows-every-executive-should-watch-1509115183?mod=searchresults&page=1&pos=7
EMPLOYERS	2017/10/25	2017/10/28	POLITICS	Trump Appointee Brings Antiabortion Mission to Immigration Shelters	Brent Kendall, Laura Meckler	Oct. 27, 2017 8:53 am ET	Scott Lloyd has pushed his agency’s policy of blocking abortions for teenagers in its custody, thrusting the administration into a losing legal fight to stop a Central American girl from ending her pregnancy.	https://www.wsj.com/articles/trump-appointee-brings-antiabortion-mission-to-immigration-shelters-1509108805?mod=searchresults&page=1&pos=8
EMPLOYERS	2017/10/25	2017/10/28	BUSINESS	CVS Makes Blockbuster Aetna Bid	Anna Wilde Mathews, Dana Mattioli, Sharon Terlep	Oct. 26, 2017 8:28 pm ET	CVS Health is in talks to buy Aetna for more than $66 billion as the drugstore giant scrambles to fortify itself against looming competition from Amazon amid a continuing reordering of the health-care industry.	https://www.wsj.com/articles/cvs-health-is-in-talks-to-buy-aetna-sources-1509047642?mod=searchresults&page=1&pos=9
EMPLOYERS	2017/10/25	2017/10/28	POLITICS	Nearly Five Months Late, Connecticut Passes a Budget	Joseph De Avila	Oct. 26, 2017 5:33 pm ET	A bipartisan coalition of Connecticut lawmakers passed a budget that will spend $41.24 billion over two years starting this past July, in an agreement that largely excluded Gov. Dannel Malloy.	https://www.wsj.com/articles/nearly-five-months-late-connecticut-passes-a-budget-1509041054?mod=searchresults&page=1&pos=10
EMPLOYERS	2017/10/25	2017/10/28	LETTERS	A Prosperous Job Market Gives Workers Better Choice	null	Oct. 26, 2017 4:18 pm ET	Competition and free trade in the job market allow the individual worker his greatest weapon, which is the ability to leave and go to another job.	https://www.wsj.com/articles/a-prosperous-job-market-gives-workers-better-choice-1509049122?mod=searchresults&page=1&pos=11
EMPLOYERS	2017/10/25	2017/10/28	BUSINESS	Harvey Weinstein Sues Weinstein Co. Seeking Access to Documents	Ben Fritz	Oct. 26, 2017 3:29 pm ET	Harvey Weinstein has sued his former employer, demanding access to documents he claims could help with his potential defense against civil and criminal claims as well as a potential claim of wrongful termination against the studio.	https://www.wsj.com/articles/harvey-weinstein-sues-weinstein-co-seeking-access-to-documents-1509046158?mod=searchresults&page=1&pos=12
EMPLOYERS	2017/10/25	2017/10/28	MANAGEMENT & CAREERS	Ask Me How Much Money I Make: Pay Gets More Transparent	Kelsey Gee	Oct. 26, 2017 12:22 pm ET	Millennials’ willingness to discuss once-secret topics like annual salary and paths to promotion is leading some companies to make pay policies more transparent.	https://www.wsj.com/articles/ask-me-how-much-money-i-make-pay-gets-more-transparent-1508929200?mod=searchresults&page=1&pos=13
EMPLOYERS	2017/10/25	2017/10/28	EARNINGS	Anthem Sees Big Drop in ACA Plan Enrollment Next Year	Anna Wilde Mathews, Cara Lombardo	Oct. 25, 2017 11:47 am ET	Anthem Inc. expects its enrollment in Affordable Care Act plans to drop by around 70% next year, highlighting the full extent of the company’s pullback from the business amid what it said was too much uncertainty about the health-law marketplaces’ future.	https://www.wsj.com/articles/anthem-earnings-rise-on-higher-premiums-1508929036?mod=searchresults&page=1&pos=14
TEAM	2018/03/13	2018/03/16	NY AP TOP NEWS	Oshie, Backstrom score as Capitals down Islanders 6-3	null	March 16, 2018 10:22 pm ET	WASHINGTON — T.J. Oshie, Nicklas Backstrom and Matt Niskanen scored as the Washington Capitals swept a home-and-home set against the skidding New York Islanders with a 6-3 win on Friday night.	https://www.wsj.com/articles/APe96929985cf24863a04419181a8a24f7?mod=searchresults&page=1&pos=1
TEAM	2018/03/13	2018/03/16	NY AP TOP NEWS	Oshie, Backstrom score as Capitals down Islanders 6-3	null	March 16, 2018 10:22 pm ET	WASHINGTON — T.J. Oshie, Nicklas Backstrom and Matt Niskanen scored as the Washington Capitals swept a home-and-home set against the skidding New York Islanders with a 6-3 win on Friday night.	https://www.wsj.com/articles/AP899a8bb446ac4db68cf96f00c99c202f?mod=searchresults&page=1&pos=2
TEAM	2018/03/13	2018/03/16	U.S.
Engineer Reported Cracks on Miami Bridge Days Before Collapse
By Scott Calvert, Valerie Bauerlein March 16, 2018 10:13 pm ET
Appeared in the March 17, 2018, print edition as 'Cracks Were Reported in Miami Bridge.'
TEAM	2018/03/13	2018/03/16	NY AP TOP NEWS	Embiid leads 76ers past Nets	null	March 16, 2018 9:47 pm ET	PHILADELPHIA — A sellout crowd of nearly 21,000 serenaded Joel Embiid for his birthday, and Embiid showed his gratitude by powering Philadelphia to another win.	https://www.wsj.com/articles/AP3d7f4e596d714ccba629110ef9bcd9c1?mod=searchresults&page=1&pos=4
TEAM	2018/03/13	2018/03/16	NY AP TOP NEWS	Vikings sign Seahawks' Richardson to bolster defensive line	null	March 16, 2018 6:44 pm ET	EAGAN, Minn. — The Minnesota Vikings found a new offensive coordinator this winter, and they made one of the biggest splashes of the NFL offseason this week by giving quarterback Kirk Cousins a fully guaranteed $84 million contract.	https://www.wsj.com/articles/APd620e3314a2d48868da65adb22a6c6b3?mod=searchresults&page=1&pos=5
TEAM	2018/03/13	2018/03/16	BUSINESS	Second Nike Executive Leaves in Wake of Workplace Complaints	Joann S. Lublin, Sara Germano	March 16, 2018 6:07 pm ET	A second veteran executive is leaving Nike Inc. in the wake of internal complaints about inappropriate workplace behavior at the sneaker and sportswear giant, according to people familiar with the matter.	https://www.wsj.com/articles/second-nike-executive-leaves-in-wake-of-workplace-complaints-1521220142?mod=searchresults&page=1&pos=6
TEAM	2018/03/13	2018/03/16	NY AP TOP NEWS	Buffalo looking for another upset with Kentucky up next	null	March 16, 2018 6:02 pm ET	BOISE, Idaho — No. 13 seed Buffalo (27-8) vs. No. 5 Kentucky (25-10)	https://www.wsj.com/articles/APb40fbbdf08524f63909fac5c497dd62b?mod=searchresults&page=1&pos=7
TEAM	2018/03/13	2018/03/16	COLLEGE BASKETBALL	How Buffalo and Marshall Took the Fast Track to NCAA Tournament Upsets	Andrew Beaton, Ben Cohen	March 16, 2018 5:54 pm ET	Underdogs like to play slow. The teams that pulled off the biggest upsets in this March Madness took the opposite approach.	https://www.wsj.com/articles/how-buffalo-and-marshall-took-the-fast-track-to-ncaa-tournament-upsets-1521237239?mod=searchresults&page=1&pos=8
TEAM	2018/03/13	2018/03/16	NY AP TOP NEWS	Ed Charles, member of 1969 Miracle Mets, dead at 84	null	March 16, 2018 5:52 pm ET	NEW YORK — Ed Charles, the third baseman known as "The Glider" who helped lead the Miracle Mets to the 1969 World Series title with his veteran guidance and poetry, has died. He was 84.	https://www.wsj.com/articles/AP8824b8697bc9483ab332e3685c2ae966?mod=searchresults&page=1&pos=9
TEAM	2018/03/13	2018/03/16	POLITICS	Donald Trump and John Kelly Reach Truce	Michael C. Bender, Rebecca Ballhaus	March 16, 2018 5:24 pm ET	President Donald Trump and John Kelly have settled on a truce, at least temporarily, to keep the chief of staff in place as the White House grapples with the turbulence of several senior departures and the prospect of further changes to come.	https://www.wsj.com/articles/donald-trump-and-john-kelly-reach-temporary-truce-1521209445?mod=searchresults&page=1&pos=10
TEAM	2018/03/13	2018/03/16	BOOKSHELF	‘Big Deal’ Review: That Fosse Flair	John Check	March 16, 2018 5:06 pm ET	As a young dancer, Fosse performed at burlesque houses—an experience that would stay with him the rest of his life.	https://www.wsj.com/articles/big-deal-review-that-fosse-flair-1521234379?mod=searchresults&page=1&pos=11
TEAM	2018/03/13	2018/03/16	NY AP TOP NEWS	Column: QBs cashing in _ except for the unwelcome Kaepernick	null	March 16, 2018 4:44 pm ET	As free agency kicked off the start of a new football season, the NFL sent a clear message to anyone paying attention:	https://www.wsj.com/articles/AP9a2500c32fdd4c22b8ab09686ec96b8d?mod=searchresults&page=1&pos=12
TEAM	2018/03/13	2018/03/16	NY AP TOP NEWS	Mississippi State could have tough road to Sweet 16	null	March 16, 2018 4:31 pm ET	STARKVILLE, Miss. — Mississippi State coach Vic Schaefer is concerned that the opening weekend of the women's NCAA Tournament might be more difficult than many anticipate.	https://www.wsj.com/articles/AP2356d4afe53a488fbb24f1439cdf1ba3?mod=searchresults&page=1&pos=13
TEAM	2018/03/13	2018/03/16	NY AP TOP NEWS	Giants sign OL Patrick Omameh and DB Curtis Riley	null	March 16, 2018 4:27 pm ET	EAST RUTHERFORD, N.J. — The New York Giants have signed offensive lineman Patrick Omameh and defensive back Curtis Riley.	https://www.wsj.com/articles/APeb973d3fb00a4b2e9248a35b49265fa4?mod=searchresults&page=1&pos=14
TEAM	2018/03/13	2018/03/16	NY AP TOP NEWS	Jets sign CB Trumaine Johnson to 5-year, $72.5 million deal	null	March 16, 2018 4:21 pm ET	NEW YORK — The Jets have locked down their shutdown cornerback.	https://www.wsj.com/articles/AP87b7129dd9ab4e2080dcd933f9a7ab37?mod=searchresults&page=1&pos=15
TEAM	2018/03/13	2018/03/16	WORLD	EU Explores Fresh Steps to Save Iran Nuclear Deal	Laurence Norman	March 16, 2018 3:49 pm ET	European foreign ministers, anxious to salvage the nuclear deal with Iran, plan to sketch out new measures to increase pressure on the country over its ballistic missile program and regional actions.	https://www.wsj.com/articles/eu-explores-fresh-steps-to-save-iran-nuclear-deal-1521223495?mod=searchresults&page=1&pos=16
TEAM	2018/03/13	2018/03/16	NY AP TOP NEWS	Penn State charges into lead at NCAA Wrestling Championships	null	March 16, 2018 3:39 pm ET	CLEVELAND — Zain Retherford hasn't spent much time considering his place in the college wrestling world or even his Penn State legacy.	https://www.wsj.com/articles/AP971584fadae344878a899a9b4d5ffc40?mod=searchresults&page=1&pos=17
TEAM	2018/03/13	2018/03/16	NY AP TOP NEWS	Wrestlemania returning to MetLife Stadium in 2019	null	March 16, 2018 2:16 pm ET	EAST RUTHERFORD, N.J. — WrestleMania is returning to MetLife Stadium in 2019.	https://www.wsj.com/articles/AP7a487f70989e4ad5b3d6aff7efdf7f96?mod=searchresults&page=1&pos=18
TEAM	2018/03/13	2018/03/16	NY AP TOP NEWS	Wrestlemania returning to MetLife Stadium in 2019	null	March 16, 2018 2:16 pm ET	EAST RUTHERFORD, N.J. — WrestleMania is returning to MetLife Stadium in 2019.	https://www.wsj.com/articles/APdb0af618448f496283dd8cbd74b8fd9d?mod=searchresults&page=1&pos=19
TEAM	2018/03/13	2018/03/16	NY AP TOP NEWS	Bills GM Beane keeping QB options open 6 weeks before draft	null	March 16, 2018 1:41 pm ET	ORCHARD PARK, N.Y. — Speculate all you want, Bills general manager Brandon Beane insisted it's premature to suggest he's trading up to select a quarterback in the first round of next month's draft.	https://www.wsj.com/articles/APeaf2778ff8754d66a17b623eb9255964?mod=searchresults&page=1&pos=20
CORE MARK	2018/03/01	2018/03/04	THE WEEKEND INTERVIEW	Bruce Rauner vs. the Illinois ‘Mafia’	James Taranto	March 2, 2018 5:44 pm ET	The outsider governor recounts his battles with the political machine and explains why he thinks a second term would be ‘transformative.’	https://www.wsj.com/articles/bruce-rauner-vs-the-illinois-mafia-1520030669?mod=searchresults&page=1&pos=1
CORE MARK	2018/03/01	2018/03/04	EUROPE	Italian Parties Have Their Final Say Before Parliamentary Elections	Giovanni Legorano, Pietro Lombardi	March 1, 2018 5:00 pm ET	Italian political parties made their closing arguments ahead of national elections, pressing their case with the millions of citizens who remain undecided ahead of this weekend’s parliamentary vote.	https://www.wsj.com/articles/italian-parties-have-their-final-say-before-parliamentary-elections-1519941634?mod=searchresults&page=1&pos=2
S T	2014/10/28	2014/10/31	TECH	Samsung Asks Judge to Invalidate Microsoft Contract	Shira Ovide	Oct. 31, 2014 9:43 pm ET	Samsung Electronics Ltd. asked a judge to declare invalid a contract under which the company paid Microsoft Corp. more than $1 billion last year, according to a court filing.	https://www.wsj.com/articles/samsung-asks-judge-to-invalidate-microsoft-contract-1414806214?mod=searchresults&page=1&pos=3
S T	2014/10/28	2014/10/31	MARKETS	Third Point, Other Investors Ask Court to Throw Out Breakup of Espírito	Margot Patrick	Oct. 31, 2014 9:33 pm ET	U.S. activist investor Third Point LLC is among several hedge-fund investors looking to throw out the Bank of Portugal’s August breakup of Banco Espírito Santo, according to a court filing Friday.	https://www.wsj.com/articles/third-point-other-investors-ask-court-to-throw-out-breakup-of-espirito-1414803104?mod=searchresults&page=1&pos=4
S T	2014/10/28	2014/10/31	MARKETS	Stocks Rally Across Globe	Corrie Driebusch, Tom Lauricella	Oct. 31, 2014 9:13 pm ET	Japan’s stimulus plans rippled across global markets, pushing the Dow Jones Industrial Average to a record, sending the dollar near a seven-year high against the Japanese yen and pulling U.S. government bond prices lower.	https://www.wsj.com/articles/stocks-rally-across-globe-1414796932?mod=searchresults&page=1&pos=5
S T	2014/10/28	2014/10/31	20 ODD QUESTIONS	Designer Ilse Crawford on the Power of Dimmers and ‘The Shining’	David A. Keeps	Oct. 31, 2014 9:13 pm ET	The interior decorator holds forth on the appeal of Bauhaus design, why the smell of wood is so important in décor and more.	https://www.wsj.com/articles/designer-ilse-crawford-on-the-power-of-dimmers-and-the-shining-1414786311?mod=searchresults&page=1&pos=6
S T	2014/10/28	2014/10/31	NY REAL ESTATE RESIDENTIAL	Bridgeport’s Black Rock Discovers ‘Cool’ Side	Melanie Lefkowitz	Oct. 31, 2014 9:13 pm ET	Black Rock, Conn., is a vibrant neighborhood where middle-class families, artists, downsizing senior citizens and young professionals live side by side.	https://www.wsj.com/articles/bridgeports-black-rock-discovers-cool-side-1414804413?mod=searchresults&page=1&pos=7
S T	2014/10/28	2014/10/31	HEARD & SCENE	Drawing a Bead on a Boutique	Marshall Heyman	Oct. 31, 2014 9:04 pm ET	A lot of cool designers help jewelry designer Irene Neuwirth celebrate the opening of her first boutique.	https://www.wsj.com/articles/drawing-a-bead-on-a-boutique-1414803876?mod=searchresults&page=1&pos=8
S T	2014/10/28	2014/10/31	NY POLITICS	Democrats ‘Shame’ Voters With Mailers	Derek Kravitz	Oct. 31, 2014 8:58 pm ET	Democratic Party postcards and letters sent to more than 800,000 New Yorkers this week gave them grades based on how often they had voted.	https://www.wsj.com/articles/democrats-shame-voters-with-mailers-1414803485?mod=searchresults&page=1&pos=9
S T	2014/10/28	2014/10/31	U.S.	U.S. Ebola Survivors Tread Painful, Lonely Journeys	Betsy McKay	Oct. 31, 2014 8:56 pm ET	The experiences of people who have been treated trace the splintered path of Ebola in America.	https://www.wsj.com/articles/u-s-ebola-survivors-tread-painful-lonely-journeys-1414801784?mod=searchresults&page=1&pos=10
S T	2014/10/28	2014/10/31	NY FOOD	Upstart Monroe College Fires Up Culinary Competitions	Sophia Hollander	Oct. 31, 2014 8:48 pm ET	Monroe College in New Rochelle, N.Y., will host this year’s American Culinary Federation New York state championships, searching for its first title. A win would accelerate Monroe’s transformation under dean Frank Costantino.	https://www.wsj.com/articles/monroe-college-in-new-rochelle-n-y-fires-up-culinary-competitions-1414802899?mod=searchresults&page=1&pos=11
S T	2014/10/28	2014/10/31	U.S.	U.S. Sanctions Myanmar Lawmaker Ahead of Obama Visit	William Mauldin	Oct. 31, 2014 8:46 pm ET	The U.S. has imposed sanctions on a Myanmar lawmaker and businessman linked to attacks on Myanmar’s democratic opposition.	https://www.wsj.com/articles/u-s-sanctions-myanmar-lawmaker-ahead-of-obama-visit-1414776276?mod=searchresults&page=1&pos=12
S T	2014/10/28	2014/10/31	U.S.	Hospitals Wrestle With Extent of Ebola Treatment	Stephanie Armour	Oct. 31, 2014 8:42 pm ET	U.S. hospitals are grappling with whether to withhold aggressive treatments from Ebola patients to avoid further exposing doctors and nurses to the virus.	https://www.wsj.com/articles/hospitals-weigh-ebola-treatment-vs-staff-safety-1414802551?mod=searchresults&page=1&pos=13
S T	2014/10/28	2014/10/31	HEARD & SCENE	A Gala Masquerading as a Gala	Pia Catton	Oct. 31, 2014 8:33 pm ET	At the Park Avenue Armory’s gala, drapery and candelabra hid all traces of the barrel-vaulted military space and transformed the ballroom into what felt like a spooky palace.	https://www.wsj.com/articles/a-gala-masquerading-as-a-gala-1414801980?mod=searchresults&page=1&pos=14
S T	2014/10/28	2014/10/31	WORLD	World Watch: News Digest	null	Oct. 31, 2014 8:20 pm ET	World Watch: News Digest	https://www.wsj.com/articles/world-watch-news-digest-1414801208?mod=searchresults&page=1&pos=15
