GOOGLE	2012/01/19	2012/01/22	EARNINGS	Google Cools Off, and Stock Drops	By Amir Efrati Jan. 20	 2012 12:01 am ET	Google's fourth-quarter earnings rose 7% but missed estimates as the firm's costs outgrew revenue, which was hampered by a surprising drop in pricing for the core search business.
GOOGLE	2012/01/19	2012/01/22	NY POLITICS	Google Lifts Chelsea, So City Hikes Tax Bill	By Josh Barbanel Jan. 20	 2012 12:01 am ET	Property taxes on Google's Chelsea office building is about to go up by 17%, the largest increase of any major New York address this year.
GOOGLE	2012/01/19	2012/01/22	U.S.	After Outcry, SOPA Backers Are Mainly Democrats	By Amy Schatz Jan. 20	 2012 12:01 am ET	The push for antipiracy legislation brought lawmakers together for much of the past year, but in the Senate at least, the support that remains after nationwide protests appears to be mostly from Democrats.
GOOGLE	2012/01/19	2012/01/22	TECH	U.S. Shuts Offshore File-Share 'Locker'	By Devlin Barrett	 Geoffrey A. Fowler	The FBI shut down the popular file-sharing website Megaupload amid a debate in Washington over online piracy legislation.
GOOGLE	2012/01/19	2012/01/22	TECH	Apple Jumps Into Textbooks	By Jeffrey A. Trachtenberg	 Jessica E. Vascellaro	Apple introduced tools designed to spur the development of textbooks and other classroom materials for the iPad, a push to drive demand for its tablet and change the education market.
GOOGLE	2012/01/19	2012/01/22	EARNINGS	Microsoft's Profit Drops Slightly as Windows Sales Fall	By Steven D. Jones Jan. 19	 2012 7:23 pm ET	Microsoft's profit slipped 0.2% as the software giant recorded lower sales in its Windows and Windows Live segment, though revenue rose in its other divisions.
GOOGLE	2012/01/19	2012/01/22	U.S. MARKETS	Stocks Finish at 6-Month High	By Chris Dieterich	 Christian Berthelsen Jan. 19	The Dow industrials gained 45 points, as jobs data and bank earnings kept the rally moving.
GOOGLE	2012/01/19	2012/01/22	TECH	India Court Postpones Google, Facebook Censorship Hearing	By Amol Sharma Jan. 19	 2012 6:14 am ET	Delhi High Court has postponed until early February hearings on petitions by Google and Facebook to quash criminal proceedings against them in a widely-watched Web censorship case.
GOOGLE	2012/01/19	2012/01/22	AHEAD OF THE TAPE	Google Investors' Web Search for Direction	By Rolfe Winkler Jan. 19	 2012 12:01 am ET	Rolfe Winkler writes that, in his first year as Google's chief executive, Larry Page has scored points for ambition. Whether that will pay off for shareholders remains to be seen.
GOOGLE	2012/01/19	2012/01/22	MEDIA & MARKETING	Foreign Copyrights Upheld	By Brent Kendall	 Jess Bravin Jan. 19	The U.S. Supreme Court upheld a 1994 law that granted copyright protection to a large number of foreign works that had been freely available in the public domain.
GOOGLE	2012/01/19	2012/01/22	TECH	Hollywood Loses SOPA Story	By Erica Orden	 Geoffrey A. Fowler Jan. 19	The entertainment industry moved to counter growing opposition to antipiracy bills. But its efforts appeared to have little effect as a series of congressional leaders dropped their support for the legislation.
GOOGLE	2012/04/12	2012/04/15	EUROPE TECHNOLOGY	TeliaSonera Wary of New Markets	By Sven Grundberg April 15	 2012 9:08 pm ET	TeliaSonera's CEO says trouble with Russian and Turkish deals has taught him the importance of majority stakes.
GOOGLE	2012/04/12	2012/04/15	NY REAL ESTATE COMMERCIAL	What's the Deal	April 15	 2012 8:25 pm ET	Landlords with big blocks of space to fill should check their mailboxes in the next couple of weeks: Time Warner, which is searching for 4 million square feet of space, plans at last to send out its requests for proposals.
GOOGLE	2012/04/12	2012/04/15	MANAGEMENT	Famed Investor Seeds New Fund	By Juliet Chung April 15	 2012 8:15 pm ET	Well-known investor Julian Robertson plans to put tens of millions of dollars into a global macro fund launched by Trient Asset Management, a firm co-founded by a former head of Norway's sovereign wealth fund, in a bet that the global economic rebound will fall short of investors' expectations.
GOOGLE	2012/04/12	2012/04/15	LAW	Proceedings | Highlights from the Law Blog	April 15	 2012 7:17 pm ET	A Georgia man was sentenced to 6½ years in prison last week for selling fake horror-movie posters and lobby cards, which he claimed were vintage.
GOOGLE	2012/04/12	2012/04/15	MEDIA & MARKETING	Food Network's New Side Dish	By Shalini Ramachandran April 15	 2012 7:14 pm ET	Scripps Networks Interactive, which owns the Food Network and other cable channels, is starting a competitor to OpenTable's online restaurant-reservation service.
GOOGLE	2012/04/12	2012/04/15	TECH	FCC Proposes $25,000 Fine on Google	By Amy Schatz April 14	 2012 6:38 pm ET	The FCC proposed a $25,000 fine, accusing Google of obstructing a probe into whether it violated federal rules when its street-mapping service collected and stored data from unencrypted Wi-Fi networks.
GOOGLE	2012/04/12	2012/04/15	COMMENTARY	Tearing Down Iran's Electronic Curtain	By And Toby Dershowitz	 Mark Dubowitz April 13	Western companies have provided the technology that enables Tehran's Internet censorship.
GOOGLE	2012/04/12	2012/04/15	ESSAY	Educating the Next Steve Jobs	By Tony Wagner April 13	 2012 6:18 pm ET	How can schools teach students to be more innovative? Offer hands-on classes and don't penalize failure.
GOOGLE	2012/04/12	2012/04/15	U.S. MARKETS	Stocks' Weekly Decline Is Worst This Year	By Chris Dieterich April 13	 2012 5:00 pm ET	The Dow industrials tumbled 1.6% this week, as disappointing economic data from China and rising borrowing costs in Spain damped sentiment on Friday.
GOOGLE	2012/04/12	2012/04/15	BOOKSHELF	How the World Gets Ahead	By Matthew Rees April 13	 2012 4:36 pm ET	Three books explain how emerging markets, innovation and entrepreneurs are transforming the world economy. Matthew Rees reviews.
GOOGLE	2012/04/12	2012/04/15	TECH	Google India Unit Dropped from Civil Suit	By R.Jai Krishna April 13	 2012 3:59 am ET	A court has dropped the Indian unit of Google from a civil suit in India but retained the U.S. parent as a party in the case, the complainant as well as a Google India official said.
GOOGLE	2012/04/12	2012/04/15	ARTS & ENTERTAINMENT	Artist, Known	By Andrew LaVallee April 13	 2012 12:01 am ET	Architect Frank Gehry talks about the DNA of his work, what he sees in Chinese art, why he dislikes design competitions and how he responds to requests for another Bilbao.
GOOGLE	2012/04/12	2012/04/15	TECH	Google Preserves Cash and Control	By Amir Efrati April 12	 2012 10:43 pm ET	Google unveiled a 2-for-1 stock split designed to assuage investors while allowing its founders to maintain control over the company.
GOOGLE	2012/04/12	2012/04/15	TECH	Smartphone Patents: The Never-Ending War	By Ashby Jones	 Jessica E. Vascellaro April 12	As competition in the more than $200 billion global smartphone industry becomes more cutthroat, Apple and other are arguing that even the smallest unique features are critical to getting an edge.
GOOGLE	2012/04/12	2012/04/15	PHOTOS	Building Outside The Box	April 12	 2012 8:13 pm ET	A Seattle couple turns to the Internet to help find and construct their dream home
GOOGLE	2012/04/12	2012/04/15	HEARD ON THE STREET	Google Founders Get Out the Vote	By Rolfe Winkler April 12	 2012 7:48 pm ET	Facebook envy? or Yahoo fear?
GOOGLE	2012/04/12	2012/04/15	COMMENTARY	Patent Trolls vs. Progress	By Andy Kessler April 12	 2012 7:36 pm ET	Before you can sue to protect your discovery, you should first have to make a product or partner with someone who does.
GOOGLE	2012/04/12	2012/04/15	U.S. MARKETS	Dow Has Its Best Day in a Month	April 12	 2012 7:19 pm ET	The Dow surged the most in nearly a month, propelled by investors' positive interpretation of speeches by senior Fed officials and hopes of strong growth in China.
GOOGLE	2012/04/12	2012/04/15	HOME FRONT	Building Outside the Box	By Nancy Keates April 12	 2012 5:17 pm ET	A Seattle couple turns to the Internet to help find and construct their dream home.
GOOGLE	2012/04/12	2012/04/15	OPINION EUROPE	Tearing Down Iran's Electronic Curtain	By And Toby Dershowitz	 Mark Dubowitz April 12	Western companies have provided the technology that enables Tehran's Internet oppression.
APPLE INC	2015/04/27	2015/04/30	BUSINESS	Eyeglass Retailer Warby Parker Is Valued at $1.2 Billion	By Douglas MacMillan April 30	 2015 9:46 pm ET	Online eyeglass retailer Warby Parker has raised a fresh round of capital that values it at more than $1 billion and will be used to bolster its expansion of brick-and-mortar stores.
APPLE INC	2015/04/27	2015/04/30	MARKETS	Financial Briefs: News Digest	April 30	 2015 8:42 pm ET	The top Wall Street supervisor at the Federal Reserve Bank of New York is resigning at year-end, and more.
APPLE INC	2015/04/27	2015/04/30	TECH	What Makes the Apple Watch Tick	By Nathan Olivarez-Giles April 30	 2015 7:59 pm ET	A research firm took apart the Apple Watch Sport and calculated the cost of parts and assembly at $83.70, or 24% of the retail price.
APPLE INC	2015/04/27	2015/04/30	MARKETS	Visa’s Earnings Flat Amid Higher Expenses	By Angela Chen	 Robin Sidel April 30	Visa said profit was flat even as revenue rose 7.8% in its fiscal second quarter and payment volumes increased 11%.
APPLE INC	2015/04/27	2015/04/30	U.S. MARKETS	U.S. Stocks Fall Sharply	By Dan Strumpf April 30	 2015 4:31 pm ET	U.S. stocks fell on Thursday, reversing much of April’s gains, as mixed economic data fueled a selloff in technology and small-company shares that until recently had been strong performers.
APPLE INC	2015/04/27	2015/04/30	TECH	Apple, IBM to Work With Japan Post to Serve Elderly	By Atsuko Fukase	 Robert McMillan April 30	Japan Post Holdings has reached a deal that could put Apple’s hardware and IBM’s software in the hands of many elderly Japanese.
APPLE INC	2015/04/27	2015/04/30	NY AP TOP NEWS	Apple, IBM, Japan Post team up to improve elderly care	April 30	 2015 9:25 am ET	NEW YORK — Apple, IBM and Japanese insurance and bank holding company Japan Post have formed a partnership to improve the lives of elderly people in the country.
APPLE INC	2015/04/27	2015/04/30	BUSINESS	OmniVision Agrees to $1.9 Billion Buyout	By George Stahl April 30	 2015 8:30 am ET	OmniVision Technologies agreed to get bought by a consortium of China-based private-equity investors in a deal that values the maker of digital-imaging solutions at $1.9 billion.
APPLE INC	2015/04/27	2015/04/30	TECH	Sony Expects Profits to Surge This Fiscal Year	By Eric Pfanner	 Takashi Mochizuki April 30	Sony predicts its videogame and digital image sensor businesses will help its profits surge.
APPLE INC	2015/04/27	2015/04/30	BUSINESS	Business Watch: News Digest	April 29	 2015 8:16 pm ET	Alibaba Group Holding Ltd. Executive Chairman Jack Ma said the Chinese e-commerce giant has been expanding too quickly, and that he plans to cap the size of the company’s workforce at current levels for the time being.
APPLE INC	2015/04/27	2015/04/30	TECH	Apple Watch: Faulty Taptic Engine Slows Rollout	By Daisuke Wakabayashi	 Lorraine Luk April 29	A key component of the Apple Watch made by one of two suppliers was found to be defective, causing limited availability of the highly anticipated new product.
APPLE INC	2015/04/27	2015/04/30	MARKETS	Asian Morning Briefing: U.S. Stocks Drop	April 29	 2015 5:31 pm ET	Asian Morning Briefing
APPLE INC	2015/04/27	2015/04/30	TECH	Apple Warns European Commission Investigation Could Result in Back Tax Payments	By Daisuke Wakabayashi April 29	 2015 3:31 pm ET	Apple warned investors it may need to pay a “material” amount of back taxes to Ireland if a European Commission investigation finds the country’s tax policy toward companies like Apple constituted illegal state support.
APPLE INC	2015/04/27	2015/04/30	BUSINESS	American Airlines Flight Delays Continue as Pilot iPad App Glitch Is Fixed	By Susan Carey April 29	 2015 3:24 pm ET	Pilots at American Airlines are being told to delete and reload an app that provides navigational charts on their company-issued iPads after a software glitch led to flight delays.
APPLE INC	2015/04/27	2015/04/30	CORPORATE WATCH	Corporate Watch: News Digest	April 29	 2015 3:06 pm ET	Vale, the world’s largest iron producer, is in talks with Chinese shipbuilders and leasing companies to build around 50 giant bulk carriers that would move iron ore to China from Brazil.
APPLE INC	2015/04/27	2015/04/30	EARNINGS	Time Warner Earnings Top Views	By Chelsey Dulaney	 Keach Hagey April 29	Time Warner reported better-than-expected profit and revenue growth, as March Madness helped drive audience growth.
APPLE INC	2015/04/27	2015/04/30	TECH	Microsoft Reaches Out to Android, Apple App Developers	By Shira Ovide April 29	 2015 1:30 pm ET	Microsoft is reaching out to software developers who have ignored Windows in a sign that the company is pulling out all the stops to keep its flagship product relevant.
APPLE INC	2015/04/27	2015/04/30	FOOD & DRINK	Young Entrepreneurs Update Teatime With Ingredients Like Guayusa	By Alina Dizik April 29	 2015 1:00 pm ET	Young entrepreneurs are turning the refined afternoon pick-me-up into a guy-friendly jolt of caffeine, with infusions of nontraditional leaves served in a no-frills atmosphere.
APPLE INC	2015/04/27	2015/04/30	SPORTS	Mayweather vs. Pacquiao: Drama and Big Money	By Don Steinberg April 29	 2015 12:41 pm ET	When Floyd Mayweather Jr. meets Manny Pacquiao on Saturday, the fight could generate $400 million. Why this match-up is grabbing the public’s imagination—and wallets.
APPLE INC	2015/04/27	2015/04/30	TECH	Apple Gains on Samsung in Smartphone Shipments	By Chelsey Dulaney April 29	 2015 11:13 am ET	Apple continued to gain ground on Samsung Electronics in the global smartphone market.
APPLE INC	2013/10/28	2013/10/31	JAPAN	SoftBank Plays Up Smartphone Games	Oct. 31	 2013 1:01 pm ET	CEO Masayoshi Son plans to make SoftBank No. 1 in smartphone games as it aims to be the world's top mobile Internet concern.
APPLE INC	2013/10/28	2013/10/31	ASIA TECHNOLOGY	Hon Hai Makes Push Into Software Development, Telecom Services	By Lorraine Luk Oct. 31	 2013 8:21 am ET	In a strategy shift, Hon Hai Precision Industry is making a push into software development and telecom services, its latest efforts to seek new avenues of growth as revenue from contract manufacturing slows.
APPLE INC	2013/10/28	2013/10/31	JAPAN	Sharp Turns Profit on LCD Business Recovery	By Hiroyuki Kachi Oct. 31	 2013 8:14 am ET	Under heavy scrutiny to prove it has the power to revive itself, Sharp Corp. said it swung into a net profit for the first time in nearly two years thanks to improved profitability at its liquid crystal display business.
APPLE INC	2013/10/28	2013/10/31	MARKETS	Earlier Nasdaq Glitch Cued Talk, No Action	By Jacob Bunge Oct. 30	 2013 8:14 pm ET	U.S. stock-market officials and regulators earlier this year may have missed a chance to head off problems related to an August glitch that stopped trading in Nasdaq Stock Market-listed securities for hours.
APPLE INC	2013/10/28	2013/10/31	FOOD & DRINK	Halloween Candy Goes Gourmet	By Cecilie Rohwedder Oct. 30	 2013 7:13 pm ET	New sweets test boundaries for Halloween and beyond. Would you like your candy in açai, beef jerky or d'Anjou pear?
APPLE INC	2013/10/28	2013/10/31	HIGH DEFINITION	High Tech's Secret Weapon: The Whiteboard	By Farhad Manjoo Oct. 30	 2013 5:52 pm ET	Whiteboards, as technologically backward as they may seem, are to Silicon Valley what legal pads are to lawyers, what Excel is to accountants, or what long sleeves are to magicians. They're an all-purpose tool of innovation, writes Farhad Manjoo.
APPLE INC	2013/10/28	2013/10/31	ASIA MARKETS	Rally in China Internet Stocks Begins to Stall	By Mia Lamar Oct. 30	 2013 5:45 pm ET	Investors begin to take profits after months of big gains push valuations to lofty levels.
APPLE INC	2013/10/28	2013/10/31	BUSINESS	Nokia to Seek U.K. HTC Sales Ban	By Sven Grundberg Oct. 30	 2013 12:25 pm ET	The Finnish company will seek financial compensation and a sales ban on mobile devices made by HTC in the U.K. after winning patent dispute.
APPLE INC	2013/10/28	2013/10/31	WEALTH ADVISER	Income-Hungry Investors Turn to Stock Options	By Murray Coleman Oct. 30	 2013 9:45 am ET	Investors on the hunt for yield are dipping into a stock-options strategy known as "covered-call writing." But some advisers warn that such strategies aren't a good substitute to earn extra income.
APPLE INC	2013/10/28	2013/10/31	ASIA MARKETS	Alibaba IPO in New York? Not So Fast	By Juro Osawa	 Nisha Gopalan Oct. 30	The Hong Kong Stock Exchange is considering changing its rules on shareholding structures, a move that could reopen the door for Alibaba to list in the city after talks broke down over the issue last month.
APPLE INC	2013/10/28	2013/10/31	TECH	BlackBerry Met With Facebook Last Week on Potential Bid	By Dana Mattioli	 Will Connors Oct. 29	BlackBerry executives flew to California to meet with Facebook last week to gauge its interest in a potential bid for the struggling smartphone-maker, according to people familiar with the matter.
APPLE INC	2013/10/28	2013/10/31	U.S. MARKETS
Dow, S&P 500 Finish at Record Highs
By Kaitlyn Kiernan Oct. 29, 2013 4:58 pm ET
APPLE INC	2013/10/28	2013/10/31	EARNINGS	Nokia Sells Record Number of Lumia Smartphones	By Sven Grundberg Oct. 29	 2013 11:23 am ET	Nokia set another record for Lumia smartphone sales during the third quarter, likely giving Microsoft investors a sliver of optimism following the $7.2 billion deal to acquire of the Finnish company's handset business.
APPLE INC	2013/10/28	2013/10/31	CFO JOURNAL	Clock Is Ticking on Some Major Tax Breaks	By Emily Chasan	 Maxwell Murphy Oct. 29	Many companies are concerned about 55 federal tax breaks that are set to expire at the end of the year. Uncertainty over their fate already is muddying financial forecasts for next year, corporate executives say.
APPLE INC	2013/10/28	2013/10/31	MARKET BEAT	Agriculture, Food Companies in Demand Down Under	By Gillian Tan Oct. 29	 2013 7:57 am ET	Investors have snapped up agricultural and food companies in Australia and New Zealand at nearly a record pace this year, as Asia's demand for high-quality food products grows.
APPLE INC	2013/10/28	2013/10/31	TECH	Google Nears Smartwatch Launch	By Eva Dou	 Lorraine Luk Oct. 29	Google is in talks with Asian suppliers to begin mass production of a smartwatch, people familiar with the matter said, its latest foray into wearable devices after Google Glass.
APPLE INC	2013/10/28	2013/10/31	BUSINESS	SK Hynix Third-Quarter Profit Rises Sharply	By Min-Jeong Lee Oct. 28	 2013 11:11 pm ET	The memory-chip maker benefitted from strong chip prices and surging demand to report a net profit of $903 million.
APPLE INC	2013/10/28	2013/10/31	TECH	Apple Shows Its Mettle Ahead of Holiday Season	By Ian Sherr Oct. 28	 2013 8:12 pm ET	Apple reported a third consecutive quarter of declining profits, but showed signs that both prices and profit margins are stabilizing despite heightened competition for its iPhone and iPad.
APPLE INC	2013/10/28	2013/10/31	NEXT IN TECH	Web Giants Threaten End to Cookie Tracking	By Elizabeth Dwoskin Oct. 28	 2013 6:50 pm ET	Microsoft and Google have said they are developing systems to control the river of Web data in ways that bypass software companies that place cookies on websites.
APPLE INC	2013/10/28	2013/10/31	EARNINGS	Biogen Reports Higher Earnings, Outlook	By Nathalie Tadena Oct. 28	 2013 11:19 am ET	Biogen's third-quarter earnings climbed 22% as sales for its multiple sclerosis treatment Tecfidera boosted the biotech's revenue.
APPLE INC	2010/01/25	2010/01/28	TECH	Motorola Reports Profit On Smartphone Sales, Cost Cuts	By Roger Cheng Jan. 28	 2010 10:29 am ET	Motorola swung to a fourth-quarter profit as the embattled handset maker showed some signs of life, thanks to the holiday launch of the Droid smartphone.
APPLE INC	2010/01/25	2010/01/28	TECH	Kodak, Reversing Loss, Sees 'Momentum Returning'	By Joel Stonington Jan. 28	 2010 8:32 am ET	The photo and imaging company swung to a $443 million profit, thanks to cost cuts, growth in digital products and improved profit margins.
APPLE INC	2010/01/25	2010/01/28	TECH	Apple's iPad Changes the Landscape for App Makers	By Yukari Iwatani Kane Jan. 28	 2010 12:01 am ET	Apple's iPad has the potential to be both a blessing and a curse to the growing ranks of companies that have developed more than 140,000 iPhone applications.
APPLE INC	2010/01/25	2010/01/28	TECH	Apple-Designed Chip Marks Strategy Shift	By Don Clark Jan. 28	 2010 12:01 am ET	Apple's new iPad uses an internally designed microprocessor, the first fruits of a strategy shift for a company that has long used external semiconductor suppliers.
APPLE INC	2010/01/25	2010/01/28	GADGETS	For Wireless Carriers, iPad Signals Further Loss of Clout	By Niraj Sheth Jan. 28	 2010 12:01 am ET	AT&T won the right to carry Apple's iPad in the U.S., a coup for the company but on terms that further erode the wireless industry's carrier-centered model.
APPLE INC	2010/01/25	2010/01/28	TECH	For Media Industry, a Mixed Bag in iPad	By Jeffrey A. Trachtenberg	 Shira Ovide Jan. 28	Apple's iPad aims to upend how people read and pay for books but there are few signs that it presents a new model for distributing TV shows, movies and magazines.
APPLE INC	2010/01/25	2010/01/28	ADVERTISING	Giving Mobile Ads a Makeover	By Emily Steel	 Jessica E. Vascellaro Jan. 28	Google, Apple and several start-ups are trying to break the mold in mobile advertising, hoping to persuade marketers to spend more on a format the tech industry has been hyping for years, with little to show for it.
APPLE INC	2010/01/25	2010/01/28	GADGETS	New Device Revives Gadget Debate	By Geoffrey A. Fowler	 Yukari Iwatani Kane Jan. 28	Apple's iPad reviews a classic gadget debate: Do consumers want devices that do one thing well, or all-in-one wonders that accomplish many tasks?
APPLE INC	2010/01/25	2010/01/28	GADGETS	Early Look: iPad Has Familiar Feel to an iPhone User	By Geoffrey A. Fowler Jan. 28	 2010 12:01 am ET	With its introduction of iPhone's big brother, Apple may have redefined the laptop.
APPLE INC	2010/01/25	2010/01/28	TECH	Amazon's Profit Soars 71%	By Geoffrey A. Fowler Jan. 28	 2010 12:01 am ET	Amazon said sales jumped 42% during the holiday quarter, and the Internet retailer forecast continued gains this quarter.
APPLE INC	2010/01/25	2010/01/28	TECH	Nokia Recharged, Motorola Trails	By Gustav Sandstrom	 Roger Cheng Jan. 28	Nokia posted a 65% jump in quarterly profit and regained market share, while rival Motorola reversed a year-ago loss but continued to lag the competition.
APPLE INC	2010/01/25	2010/01/28	BUSINESS	Movie Gallery Plans Restructuring	By Mike Spector	 Peter Lattman Jan. 28	Hollywood Video owner Movie Gallery is preparing a restructuring plan that involves closing as many as two-thirds of its video-rental outlets.
APPLE INC	2010/01/25	2010/01/28	TECH	Holiday PC Sales Boost Microsoft	By Nick Wingfield Jan. 28	 2010 12:01 am ET	Microsoft's quarterly profit jumped 60% as the software giant benefited from strong sales of computers running its new Windows 7.
APPLE INC	2010/01/25	2010/01/28	PHOTOS	Meet the iPad	Jan. 27	 2010 4:45 pm ET	Apple Inc. CEO Steve Jobs on Wednesday unveiled the iPad, a tablet-style computer that resembles the iPhone, but larger.
APPLE INC	2010/01/25	2010/01/28	INFOGRFX SLIDE SHOW MINI	Meet the iPad	Jan. 27	 2010 3:01 pm ET	Steve Jobs said the bar for a third category of device, something between a smart phone and a laptop, is high.
APPLE INC	2010/01/25	2010/01/28	REPLY TO ALL	Tabula Rasa: Apple's Press Release, Before the Editing	By Peter Jeffrey Jan. 27	 2010 12:01 am ET	Talk about excitement. Is this the tablet from California or the one from Sinai? Reply to All offers a rare glimpse behind the Cupertino curtain.
APPLE INC	2010/01/25	2010/01/28	WHO'S NEWS	Borders Group CEO Ron Marshall Resigns	By Jeffrey A. Trachtenberg	 Joann S. Lublin Jan. 27	Ron Marshall resigned as president and chief executive of Borders Group to take the reins of supermarket chain A&P.
APPLE INC	2010/01/25	2010/01/28	GADGETS	Foxconn Shares Drop on Profit Warning	By Chester Yung	 Lorraine Luk Jan. 26	The contract mobile phone manufacturer said it expects a "significant decline" in 2009 profit because the global economic downturn hit demand and prices.
APPLE INC	2010/01/25	2010/01/28	GADGETS	Apple Tablet Portends Rewrite for Publishers	By Jeffrey A. Trachtenberg Jan. 26	 2010 12:01 am ET	Book publishers were locked in 11th-hour negotiations with Apple that aim to rewrite the industry's revenue model after the technology giant unveils its highly anticipated tablet device.
APPLE INC	2010/01/25	2010/01/28	GADGETS	Apple Seeks to Avoid Past Tablet Flops	By Don Clark	 Yukari Iwatani Kane Jan. 26	As Apple prepares to unveil its tablet, the biggest question is whether changes since the early 1990s in the technology landscape—and consumer habits—could give it a different ending than previous tablet forays.
