GOOGLE	2014/01/30	2014/02/02	ASIA MARKETS	Asian Morning Briefing: U.S. Stocks Bounce Back	Jan. 30	 2014 5:44 pm ET	Asian Morning Briefing
GOOGLE	2014/01/30	2014/02/02	HEARD ON THE STREET	Facebook Mobilizes Its Ad Army	By Miriam Gottfried Jan. 30	 2014 5:17 pm ET	Facebook's results dispelled fears that in its quest to appease users it would cap its own ability to grow advertising.
GOOGLE	2014/01/30	2014/02/02	BUSINESS	Telenav Acquires Mapping Startup Skobbler for $24 Million	By Lora Kolodny Jan. 30	 2014 4:59 pm ET	Personal navigation company Telenav has acquired Skobbler, a German startup that makes map apps and mobile games, for $24 million in cash and stock.
GOOGLE	2014/01/30	2014/02/02	U.S. MARKETS	Stocks Bounce Back, Boosted by Facebook, Visa	By Chris Dieterich Jan. 30	 2014 4:50 pm ET	Stocks rebounded from a string of declines sparked by turmoil in developing markets. Stronger-than-forecast earnings reports from Facebook and Visa helped power gains.
GOOGLE	2014/01/30	2014/02/02	TECH	Facebook Profit Surges as Ad Sales Grow	By Reed Albergotti Jan. 30	 2014 2:51 pm ET	Facebook's fourth-quarter earnings surged thanks in large part to mobile advertising, which now contributes more than half of the company's total advertising revenue.
APPLE INC	2010/10/18	2010/10/21	TECH	Baidu Profit Doubles to Quarterly Record	By Joan E. Solsman	 Owen Fletcher Oct. 21	Baidu Inc.'s third-quarter net profit doubled from a year earlier to a record due to increases in users and spending on advertising, as China's top Internet search engine continued to benefit from Google Inc.'s declining presence there.
APPLE INC	2010/10/18	2010/10/21	EUROPE	Nokia's earnings lift stock, new CEO	Oct. 21	 2010 10:54 pm ET	Nokia shares surged after the company swung to a third-quarter profit, providing a boost for new Chief Executive Stephen Elop and signalling that the battle against its smartphone rivals has begun.
APPLE INC	2010/10/18	2010/10/21	BUSINESS	Wal-Mart Set To Sell the Nook	By Jeffrey A. Trachtenberg Oct. 21	 2010 9:12 pm ET	In a move to greatly expand the universe of e-reader customers, Wal-Mart Stores Inc. will begin selling Barnes & Noble Inc.'s Nook device at 2,500 stores and online as soon as Oct. 24.
APPLE INC	2010/10/18	2010/10/21	TECH	Kleiner Perkins Plans Social Media Fund	By Scott Morrison Oct. 21	 2010 2:49 pm ET	Venture capital group Kleiner Perkins Caufield & Byers launched a $250 million fund to back entrepreneurs inventing social applications and services, with the backing of Amazon and Facebook.
APPLE INC	2010/10/18	2010/10/21	GADGETS	Apple Updates MacBook Air, Macintosh Software	By Ian Sherr	 Yukari Iwatani Kane Oct. 21	Apple released two new MacBook Air ultralight laptops that use flash memory for storage instead of hard drives, and promised updated software for its Macintosh computers that borrows features from its iPhone and iPad.
APPLE INC	2010/10/18	2010/10/21	GADGETS	Verizon Wireless to Sell Samsung Tablet for $600	By Nathan Becker Oct. 21	 2010 12:01 am ET	Samsung's Galaxy Tab, one of the first tablets to rival Apple's iPad, will hit Verizon Wireless stores Nov. 11 and cost $599.99.
APPLE INC	2010/10/18	2010/10/21	TECH	Silicon Valley 3.0: Tech's New Wave	By Cari Tuna	 Pui-Wing Tam Oct. 21	Silicon Valley's start-up economy has quietly broadened beyond IT to now include a growing cadre of bioscience and "clean technology" firms.
APPLE INC	2010/10/18	2010/10/21	MARKETS	Oracle, Apple: Money Flow Leaders (ORCL, AAPL)	By MARKET DATA STAFF Oct. 20	 2010 4:50 pm ET	Markets Data Center: Money Flow Leaders.
APPLE INC	2010/10/18	2010/10/21	TECH	Netbook slump tests Acer's record of growth	By Ian Sherr Oct. 20	 2010 3:45 pm ET	For two years, Acer has relied on netbooks—tiny, stripped-down laptops—to propel growth. Now the netbook craze is petering out.
APPLE INC	2010/10/18	2010/10/21	TECH	Some Flashy Retail Sites Come Up Short on the iPad	By Rachel Dodes	 Yukari Iwatani Kane Oct. 20	Ahead of the holidays, some retailers are fretting that their jazzy websites don't function properly on the iPad because of Apple's refusal to support Adobe Flash technology.
APPLE INC	2010/10/18	2010/10/21	AHEAD OF THE TAPE	New Nokia CEO Needs Performance of Life	By Christopher Lawton Oct. 20	 2010 12:01 am ET	Stage debuts are always big events, and Stephen Elop's will be no different when the new Nokia CEO formally addresses investors for the first time.
APPLE INC	2010/10/18	2010/10/21	TECH	Intel to Invest $6 Billion in Plants	By Don Clark Oct. 20	 2010 12:01 am ET	Intel said it plans to invest between $6 billion and $8 billion on upgrading its manufacturing technology in U.S. facilities, including building a new plant in Oregon.
APPLE INC	2010/10/18	2010/10/21	TECH	Google to Combat India Piracy	By Amol Sharma Oct. 20	 2010 12:01 am ET	Google launched a music service in India to help users search for legal online streams and downloads, a move aimed at combating rampant digital piracy that has held back the country's entertainment industry.
APPLE INC	2010/10/18	2010/10/21	TECH	Verizon Wireless to Offer Cheaper Data Plan	By Roger Cheng Oct. 20	 2010 12:01 am ET	Verizon Wireless plans to introduce a $15 data plan with a monthly usage limit for smartphone customers, in a move that follows AT&T's capped offerings.
APPLE INC	2010/10/18	2010/10/21	ABOUT THE HOUSE	Drafty Fireplaces Meet Their Match	By Gwendolyn Bounds Oct. 20	 2010 12:01 am ET	High-tech fireplace inserts and stoves give options to homeowners with drafty, old hearths.
APPLE INC	2010/10/18	2010/10/21	OPTIONS	Options Traders Stick With Apple	By Donna Kardos Yesalavich Oct. 19	 2010 4:53 pm ET	Despite disappointment in the stock market over Apple's quarterly earnings, options traders were putting on bets Tuesday that the stock might climb over $320 as soon as Friday.
APPLE INC	2010/10/18	2010/10/21	EUROPE MARKETS	European Markets Move Lower	By Andrea Tryphonides	 Ishaq Siddiqi Oct. 19	European stocks fell, with producers of basic resources pacing the decline following a surprise short-term interest-rate increase by China.
APPLE INC	2010/10/18	2010/10/21	MARKETS	Apple, Potash Corp. of Saskatchewan: Money Flow Leaders (AAPL, POT)	By MARKET DATA STAFF Oct. 19	 2010 12:44 pm ET	Markets Data Center: Money Flow Leaders.
APPLE INC	2010/10/18	2010/10/21	TECH	Tech Rivals Wage War of Words	By Amir Efrati	 Stuart Weinberg Oct. 19	Research In Motion said "customers are getting tired of being told what to think by Apple," following Steve Jobs's comments about the BlackBerry maker.
APPLE INC	2010/10/18	2010/10/21	MARKETS	Potash Corp. of Saskatchewan, Apple: Money Flow Leaders (POT, AAPL)	By MARKET DATA STAFF Oct. 18	 2010 4:44 pm ET	Markets Data Center: Money Flow Leaders.
APPLE INC	2011/01/18	2011/01/21	ASIAN BUSINESS NEWS	LG Display Swings to Loss	By Jung-Ah Lee	 Se-Young Lee Jan. 21	LG Display reported it swung to a fourth-quarter net loss due to falling panel prices and a hefty fine imposed by the European Commission for price fixing in the liquid crystal display market.
APPLE INC	2011/01/18	2011/01/21	TECH	Power Shifts Atop Google	By Amir Efrati	 Jessica E. Vascellaro Jan. 21	Google surprised the technology world by naming co-founder Larry Page to replace longtime Chief Executive Eric Schmidt, the biggest management shake-up since the Internet search giant was an obscure California start-up.
APPLE INC	2011/01/18	2011/01/21	EARNINGS	Sony Ericsson Posts Profit But Sales Sink	By Gustav Sandstrom Jan. 21	 2011 12:01 am ET	Mobile-phone maker Sony Ericsson eked out a small fourth-quarter profit, as the company cut prices to woo customers.
APPLE INC	2011/01/18	2011/01/21	ASIA TECHNOLOGY	Samsung Electronics Buys Display Maker	By Jung-Ah Lee Jan. 21	 2011 12:01 am ET	Samsung Electronics said Thursday it acquired Dutch display technology firm Liquavista for an undisclosed sum last month in the latest move by the Korean technology giant to expand into next-generation displays.
APPLE INC	2011/01/18	2011/01/21	MARKETS	Apple, JPMorgan Chase: Money Flow Leaders (AAPL, JPM)	By MARKET DATA STAFF Jan. 20	 2011 4:29 pm ET	Markets Data Center: Money Flow Leaders.
APPLE INC	2011/01/18	2011/01/21	AHEAD OF THE TAPE	Remember Google? Earnings Will Ring Bell	By Kelly Evans Jan. 20	 2011 12:01 am ET	Apple and Facebook have been grabbing all the attention, but Google could muscle its way back into the technology spotlight with its fourth-quarter earnings.
APPLE INC	2011/01/18	2011/01/21	GADGETS	Nokia Cancels U.S. Launch of X7 Phone	By Christopher Lawton	 Shayndi Raice Jan. 20	Nokia has canceled the U.S. release of a smartphone that was slated to launch exclusively this year with AT&T, the latest setback in the U.S. for the cellphone giant.
APPLE INC	2011/01/18	2011/01/21	MARKETS	Apple, Procter & Gamble: Money Flow Leaders (AAPL, PG)	By MARKET DATA STAFF Jan. 19	 2011 4:43 pm ET	Markets Data Center: Money Flow Leaders.
APPLE INC	2011/01/18	2011/01/21	BUSINESS TECHNOLOGY	Business Spending Bolsters Tech Earnings	By Roger Cheng	 Shara Tibken Jan. 19	IBM, Apple and Intel each reported record quarterly results, pushed by corporations pouring more cash into technology. While still early in the earnings season, the results from the bellwethers bode well for others.
APPLE INC	2011/01/18	2011/01/21	MEDIA & MARKETING	Starbucks to Allow Customers to Pay Via Some Smartphones	By Tess Stynes Jan. 19	 2011 2:53 pm ET	Starbucks will allow customers at U.S. company-operated stores to use some smartphones to pay for their purchases in an effort to drive sales.
APPLE INC	2011/01/18	2011/01/21	ASIAN BUSINESS NEWS	Softbank Sells $660 Million Bonds in Corporate Issuance Flourish	By Megumi Fujikawa Jan. 19	 2011 2:01 pm ET	Softbank Corp., the exclusive supplier of the iPhone in Japan, is selling more than $660 million in bonds to institutional investors in another sign that lower-rated companies are returning to the corporate-bond market.
APPLE INC	2011/01/18	2011/01/21	EARNINGS	ASML Reports Surge in Profit, Sales	By Archibald Preuschat Jan. 19	 2011 1:42 pm ET	ASML reported record fourth-quarter results, but its shares fell amid concerns over its outlook for the current quarter.
APPLE INC	2011/01/18	2011/01/21	EARNINGS	Apple Soars, but Mum on Jobs	By Yukari Iwatani Kane Jan. 19	 2011 12:01 am ET	Apple posted a 78% surge in profit and record sales of its gadgets in the holiday quarter, but the company's executives ignored the sudden medical leave of CEO Steve Jobs.
APPLE INC	2011/01/18	2011/01/21	TECH	Sprint to Raise Smartphone Data Fees	By Roger Cheng Jan. 19	 2011 12:01 am ET	Sprint Nextel plans to add a $10 fee on top of its smartphone data-service plans later this month to offset rising costs from increased wireless traffic on its network.
APPLE INC	2011/01/18	2011/01/21	NEW YORK	Two Arrested in iPad Security Breach	By Chad Bray Jan. 19	 2011 12:01 am ET	Two men were arrested Tuesday in an alleged security breach of AT&T servers last June that may have exposed personal information about 120,000 iPad users.
APPLE INC	2011/01/18	2011/01/21	OPTIONS	Low VIX Viewed as an Opportunity—For Now	By Brendan Conway	 Chris Dieterich Jan. 18	The stock market's volatility index remains near three-year lows, and to some strategists, that is less of a bullish sign than an opportunity to scoop up portfolio insurance before what they see as an inevitable stock-market correction.
APPLE INC	2011/01/18	2011/01/21	OPTIONS	Apple Options Traders Ready for Fresh All-Time High	By Brendan Conway	 Chris Dieterich Jan. 18	Options traders are aiming for Apple's stock to hit another all-time high this week, a glimmer of optimism not evident in the company's falling share price.
APPLE INC	2011/01/18	2011/01/21	GADGETS	Apple Shares Fall as Jobs Takes Medical Leave	By Roger Cheng Jan. 18	 2011 1:53 pm ET	Apple's shares were down less than 3% Tuesday, after falling as much as 6.5% earlier, a day after it disclosed that Steve Jobs would take another unexpected medical leave.
APPLE INC	2011/01/18	2011/01/21	TECH	Sony to Close N.J. CD Plant	By Nat Worden Jan. 18	 2011 11:48 am ET	Sony is closing a CD plant in Pitman, N.J., moving those operations to a factory in Indiana. The change reflects the decline in music CD sales
APPLE INC	2011/01/18	2011/01/21	ASIA MARKETS
Chip Makers Lift Asia Markets
By Leslie Shaffer, Shri Navaratnam, V. Phani Kumar Jan. 18, 2011 5:43 am ET
APPLE INC	2014/10/20	2014/10/23	TECH	Apple Plans More Stores in China	By Gillian Wong Oct. 23	 2014 10:40 pm ET	Apple plans to increase the number of its Apple-brand retail stores in Greater China to 40 from 15 within two years, CEO Tim Cook told local media.
APPLE INC	2014/10/20	2014/10/23	BUSINESS	Corporate Watch	Oct. 23	 2014 10:14 pm ET	Unilever PLC on Thursday warned of a tough global outlook and struck a gloomy tone after reporting its slowest quarterly sales growth in five years, raising fears of a continued economic slowdown across emerging markets.
APPLE INC	2014/10/20	2014/10/23	TECH	Microsoft Bucks Trend as Sales Defy Expectations	By Shira Ovide Oct. 23	 2014 8:53 pm ET	Microsoft’s sales continue to defy expectations by growing at a much faster clip than those of its business-technology peers.
APPLE INC	2014/10/20	2014/10/23	TECH	Apple’s Ex-Retail Chief Leads Startup	By Daisuke Wakabayashi Oct. 23	 2014 7:18 pm ET	Ron Johnson, who helped build Apple’s successful retail stores before a troubled stint as J.C. Penney CEO, is readying a well-funded startup that aims to help online shoppers find the right products.
APPLE INC	2014/10/20	2014/10/23	TECH	Apple, GT Advanced Technologies in Agreement on Sapphire Materials	By Daisuke Wakabayashi	 Peg Brickley Oct. 23	GT Advanced and Apple reached an agreement on winding down production of sapphire materials.
APPLE INC	2014/10/20	2014/10/23	EARNINGS	Pandora Media Loss Narrows; Listener Hours Up 25%	By Maria Armental Oct. 23	 2014 4:42 pm ET	Pandora Media reported a 25% increase in the number of hours listeners tuned in during the third quarter, the first year-to-year comparison since the Internet radio giant ended its 40-hour free-listening monthly cap.
APPLE INC	2014/10/20	2014/10/23	EARNINGS	Logitech Says Tablet Slowdown Won’t Derail Its Turnaround	By John Revill Oct. 23	 2014 12:18 pm ET	Logitech said its turnaround won’t be derailed by a slowdown in the tablet computer market, as its second-quarter net profit more than doubled.
APPLE INC	2014/10/20	2014/10/23	TECH	Foxconn in Talks for China Display Plant	By Lorraine Luk Oct. 23	 2014 8:35 am ET	Foxconn, the company that assembles the bulk of the world’s iPhones, is in preliminary talks to build a factory in northern China that would make high-end screens for the phones as well, in a sign of the company’s ambition to move up the electronics food chain.
APPLE INC	2014/10/20	2014/10/23	TECH	Nokia Gives Bullish Outlook as It Swings Back to Profit	By Sven Grundberg Oct. 23	 2014 6:24 am ET	Nokia’s quarterly earnings gave ample evidence that the company’s main network unit has moved well beyond several years of painful restructuring.
APPLE INC	2014/10/20	2014/10/23	TECH	Why You Can’t Trust You’re Getting the Best Deal Online	By Elizabeth Dwoskin Oct. 23	 2014 12:01 am ET	A new study of top e-commerce sites found the practice of personalizing prices for the same goods, or pushing some people toward higher-priced offers, is more widespread than previously understood.
APPLE INC	2014/10/20	2014/10/23	AHEAD OF THE TAPE	Time for Amazon to Turn the Page	By Spencer Jakab Oct. 22	 2014 8:41 pm ET	Ahead of the Tape: Amazon’s share price has recovered from its tumble after the Fire phone’s flop, but recent weakness suggests investors are running out of patience.
APPLE INC	2014/10/20	2014/10/23	BUSINESS	Corporate Watch	Oct. 21	 2014 10:57 pm ET	GT Advanced Technologies has signed a pact with Apple Inc. for an “amicable parting of the ways,” Luc Despins, attorney for the bankrupt supplier to the technology giant, said Tuesday.
APPLE INC	2014/10/20	2014/10/23	U.S. MARKETS	U.S. Stocks Surge; Nasdaq Up 2.4%	By Saumya Vaishampayan Oct. 21	 2014 10:46 pm ET	U.S. stocks rallied Tuesday, with gains in technology stocks propelling the Nasdaq Composite to its biggest one-day percentage jump since January 2013.
APPLE INC	2014/10/20	2014/10/23	EUROPE	Business-Friendly Bureaucrat Helped Build Tax Haven in Luxembourg	By Matthew Karnitschnig	 Robin van Daalen Oct. 21	Marius Kohl spent years engineering Luxembourg’s most valuable export: tax relief, which is now under pressure from the European Union.
APPLE INC	2014/10/20	2014/10/23	JAPAN	Japan’s Trade Deficit Edges Up	By Mitsuru Obe Oct. 21	 2014 8:57 pm ET	Japan’s trade deficit edges up in September despite a rebound in exports helped by a weaker yen and a surge in output among suppliers of Apple Inc.’s new smartphones.
APPLE INC	2014/10/20	2014/10/23	TECH	GT Advanced, Apple in Deal for ‘Amicable’ Split-Up	By Peg Brickley Oct. 21	 2014 6:41 pm ET	GT Advanced Technologies has signed a pact with Apple Inc. for an “amicable parting of the ways,” Luc Despins, attorney for the bankrupt supplier to the technology giant, said Tuesday.
APPLE INC	2014/10/20	2014/10/23	TECH	Apple’s iCloud Service Is Under Attack in Mainland China	Oct. 21	 2014 5:37 pm ET	Apple’s iCloud service for users in mainland China has been hit by an attack that could allow perpetrators to intercept and see usernames, passwords and other personal data, activists and security analysts said.
APPLE INC	2014/10/20	2014/10/23	ASIA STOCKS	Asian Morning Briefing: U.S. Stocks End With Broad Gains	Oct. 21	 2014 5:30 pm ET	Asian Morning Briefing
APPLE INC	2014/10/20	2014/10/23	CAREERS	Bosses Seek ‘Critical Thinking,’ but What Is That?	By Melissa Korn Oct. 21	 2014 4:35 pm ET	Critical thinking is a critical skill for young workers these days, but what bosses mean by that and how to measure it is less clear.
APPLE INC	2014/10/20	2014/10/23	TECH	British Chip Designer ARM’s Profit Rises	By Lisa Fleisher Oct. 21	 2014 1:38 pm ET	British semiconductor designer ARM Holdings reported a sharp rise in third-quarter profit, but the results disappointed investors expecting a more robust rebound in revenue.
APPLE INC	2015/01/27	2015/01/30	BUSINESS	Jay Z Offers $56 Million For Online Music Service	By Jens Hansegard Jan. 30	 2015 8:22 pm ET	Rapper Jay Z is the latest artist vying to own streaming music services.
APPLE INC	2015/01/27	2015/01/30	U.S.
Arizona Officials Look to Score Economic Points With Super Bowl XLIX
By Erica E. Phillips Jan. 30, 2015 6:51 pm ET
APPLE INC	2015/01/27	2015/01/30	U.S. MARKETS	U.S. Stocks Drop as GDP Growth Slows	By Corrie Driebusch	 Dan Strumpf Jan. 30	U.S. stocks fell on Friday, with the Dow Jones Industrial Average and the S&P 500 posting their biggest monthly losses in a year.
APPLE INC	2015/01/27	2015/01/30	TECH	Apple, Google and Amazon Reach ‘Freemium’ Agreement	By Eric Sylvers Jan. 30	 2015 1:14 pm ET	Apple, Google. and Amazon.com have reached an accord that allows the U.S. companies to avoid fines for allegedly misleading people in the EU to make purchases in mobile phone apps that are initially free to download.
APPLE INC	2015/01/27	2015/01/30	BUSINESS	On McDonald’s Menu: CEO With a Fresh Perspective	By David Kesmodel	 Ilan Brat Jan. 30	In tapping Steve Easterbrook as its new chief executive, McDonald’s has opted for a company insider with an unusual attribute: an outsider’s perspective.
APPLE INC	2015/01/27	2015/01/30	CORRECTIONS & AMPLIFICATIONS	Corrections & Amplifications	Jan. 29	 2015 11:10 pm ET	Corrections & Amplifications for the edition of Jan. 30, 2015.
APPLE INC	2015/01/27	2015/01/30	BUSINESS	Corporate Watch: News Digest	Jan. 29	 2015 9:52 pm ET	The FCC’s biggest-ever auction of wireless spectrum closed Thursday, and more.
APPLE INC	2015/01/27	2015/01/30	WORLD	Taiwan’s Fourth-Quarter Growth Slows	By Fanny Liu Jan. 29	 2015 8:36 pm ET	Taiwan’s economy expanded more slowly in the fourth quarter, as falling oil prices hurt petrochemical exports, though demand for electronics remained strong.
APPLE INC	2015/01/27	2015/01/30	TECH	Google Revenue Hurt by Rising Dollar	By Alistair Barr	 Rolfe Winkler Jan. 29	The rising dollar claimed another victim as Google’s revenue grew slower than expected. Absent the dollar’s impact, revenue would have risen roughly 20%.
APPLE INC	2015/01/27	2015/01/30	TECH	Cablevision Sues Verizon Claiming False Advertising Over New York Wi-Fi Services	By Maria Armental Jan. 29	 2015 6:55 pm ET	Cablevision Systems is suing Verizon Communications, accusing Verizon of falsely advertising the “fastest Wi-Fi available” in New York in an attempt to undercut Cablevision’s competitive advantage.
APPLE INC	2015/01/27	2015/01/30	MARKETS	Visa Reports Rise in Quarterly Profit	By Josh Beckerman	 Robin Sidel Jan. 29	Visa Inc. reported quarterly earnings that topped Wall Street expectations as the company posted growth in payment volume and announced a four-for-one stock split.
APPLE INC	2015/01/27	2015/01/30	MEDIA & MARKETING	Canadians to See Super Bowl Ads—in 2017	By Paul Vieira Jan. 29	 2015 5:21 pm ET	Canada’s broadcast regulator said it will lift a rule that effectively prevents Canadians from seeing American Super Bowl ads during the game. But the change won’t occur until 2017
APPLE INC	2015/01/27	2015/01/30	TECH	Spotify Seeks to Raise About $500 Million	By Evelyn M.Rusli	 Telis Demos Jan. 29	Music streaming service Spotify is working with Goldman Sachs on a new round of private fundraising, potentially putting off an initial public offering for another year.
APPLE INC	2015/01/27	2015/01/30	TECH	Sony Bails Out of Music Streaming	By Hannah Karp Jan. 29	 2015 2:15 pm ET	A shake-out in the market for music-streaming services appears to be gathering steam. Sony said it is shutting down its $10-a-month Music Unlimited at the end of March, four years after launching it in the U.S.
APPLE INC	2015/01/27	2015/01/30	U.S. MARKETS	Oil Outweighs the Fed as Stocks Tumble Again	By Alexandra Scaggs	 Min Zeng	A sharp drop in oil prices overshadowed the Federal Reserve, with energy companies leading a selloff in U.S. stocks.
APPLE INC	2015/01/27	2015/01/30	TECH	Samsung, Apple Back in Dead Heat for Global Smartphone Dominance	By Jonathan Cheng	 Min-Jeong Lee Jan. 29	The fortunes of the world’s two biggest smartphone makers crossed paths again, as contrasting earnings reports from Apple and Samsung Electronics put the two technology giants back in a dead heat for leadership of the global market.
APPLE INC	2015/01/27	2015/01/30	BUSINESS	U.S. Business Groups Ask China to Postpone New Cybersecurity Review	By Carlos Tejada Jan. 29	 2015 3:53 am ET	U.S. business groups are asking China to postpone a new cybersecurity review process that they say is too intrusive and involves disclosing sensitive material to the Chinese government.
APPLE INC	2015/01/27	2015/01/30	TECH	LG Electronics Reports Unexpected Loss for October-December	By Min-Jeong Lee Jan. 29	 2015 3:43 am ET	LG attributes the weak performance to its TV business, which ended operations in November.
APPLE INC	2015/01/27	2015/01/30	TECH	Hon Hai Units’ Merger Plan Hits Hurdle	By Aries Poon	 Lorraine Luk Jan. 29	Hon Hai’s effort to expand beyond contract manufacturing has hit a hurdle after Taiwan regulators asked that a merger proposal for its two telecom units be resubmitted.
APPLE INC	2015/01/27	2015/01/30	TECH	Can Apple Keep Up Its Growth Spurt?	By Daisuke Wakabayashi Jan. 29	 2015 12:01 am ET	Record quarter may result from pent-up big-phone demand among Apple customers or the start of a new growth trajectory.
GOOGLE	2012/01/19	2012/01/22	BUSINESS TECHNOLOGY	Who Is New RIM CEO Thorsten Heins?	By Will Connors Jan. 22	 2012 10:34 pm ET	The man who inherits the challenge of turning around RIM is a little-known company insider.
GOOGLE	2012/01/19	2012/01/22	INFORMATION AGE	Moore's Law Trumps More Law	By L. Gordon Crovitz Jan. 22	 2012 7:10 pm ET	Copyright violators should be punished, but not by turning over the Web to Washington.
GOOGLE	2012/01/19	2012/01/22	MONEY	'Will Your Kids Do Better Than You?'	By Demetria Gallegos Jan. 22	 2012 12:01 am ET	Journal Communityis the social network where you can ask questions and share your knowledge and expertise. Join the discussion.
GOOGLE	2012/01/19	2012/01/22	HEARD ON THE STREET	Google to Dial Up Slower Growth	By Rolfe Winkler Jan. 21	 2012 12:01 am ET	If Google's investors can't stomach a strong dollar, will it be tougher to digest Motorola Mobility?
GOOGLE	2012/01/19	2012/01/22	TECH	Congress Tosses Antipiracy Bills	By Eric Morath	 Geoffrey A. Fowler Jan. 21	Leaders of the Internet movement that turned little-noticed antipiracy legislation into a national cause proclaimed victory Friday after congressional backers abandoned their bills.
GOOGLE	2012/01/19	2012/01/22	BOOKSHELF	There and Back Again	By Tom Shippey Jan. 21	 2012 12:01 am ET	The story of how writers' fictional worlds have colonized real life. Tom Shippey reviews "As If."
GOOGLE	2012/01/19	2012/01/22	LIFE	Merit Badges for the Job Market	By Jeffrey R. Young Jan. 21	 2012 12:01 am ET	Borrowing from the Boy Scouts, colleges and companies are experimenting with alternatives to diplomas.
GOOGLE	2012/01/19	2012/01/22	U.S. MARKETS	Dow Has Blue-Chip Day	By Chris Dieterich Jan. 20	 2012 11:24 pm ET	Strong earnings from IBM powered blue-chip stocks even as discouraging quarterly reports from other bellwethers kept a lid on broader market gains.
GOOGLE	2012/01/19	2012/01/22	TECH	New Display Ad Push Adds to Bag of Tricks	By Amir Efrati Jan. 20	 2012 12:01 am ET	Google, long labeled as a one-trick pony that sells Web-search text ads and little else, is quickly learning another trick: selling online display ads.
